"uri","additional name","constituency > label","family name","full name","gender","given name","home page","home page > uri","label","party","twitter"
"http://data.parliament.uk/members/1639",,"Truro","Dixon","Piers Dixon","Male","Piers",,,"Biography information for Piers Dixon","Conservative",
"http://data.parliament.uk/members/4976","Kate","City of Chester","Dixon","Samantha Dixon","Female","Samantha",,,"Biography information for Samantha Dixon","Labour","https://twitter.com/samanthadixonmp"
"http://data.parliament.uk/members/2603",,,"Dixon","Lord Glentoran","Male","Thomas",,,"Biography information for Lord Glentoran",,
"http://data.parliament.uk/members/2713",,,"Dixon Smith","Lord Dixon-Smith","Male","Robert",,,"Biography information for Lord Dixon-Smith",,
"http://data.parliament.uk/members/1425","Simon","Huntingdon","Djanogly","Mr Jonathan Djanogly","Male","Jonathan",,,"Biography information for Mr Jonathan Djanogly","Conservative",
"http://data.parliament.uk/members/446",,"Heywood and Middleton","Dobbin","Jim Dobbin","Male","James",,,"Biography information for Jim Dobbin","Labour (Co-op)",
"http://data.parliament.uk/members/4192","John",,"Dobbs","Lord Dobbs","Male","Michael","www.michaeldobbs.com","http://www.michaeldobbs.com/","Biography information for Lord Dobbs",,
"http://data.parliament.uk/members/180","Gordon","Holborn and St Pancras","Dobson","Frank Dobson","Male","Frank",,,"Biography information for Frank Dobson","Labour",
"http://data.parliament.uk/members/4600",,"Aldershot","Docherty","Leo Docherty","Male","Leo",,,"Biography information for Leo Docherty","Conservative",
"http://data.parliament.uk/members/3962",,"Dunfermline and West Fife","Docherty","Thomas Docherty","Male","Thomas ",,,"Biography information for Thomas Docherty","Labour",
"http://data.parliament.uk/members/4374","John","West Dunbartonshire","Docherty-Hughes","Martin Docherty-Hughes","Male","Martin",,,"Biography information for Martin Docherty-Hughes","Scottish National Party",
"http://data.parliament.uk/members/4657","Jane","Oxford East","Dodds","Anneliese Dodds","Female","Anneliese","www.anneliesedodds.org.uk","http://www.anneliesedodds.org.uk","Biography information for Anneliese Dodds","Labour (Co-op)",
"http://data.parliament.uk/members/4718",,"Brecon and Radnorshire","Dodds","Jane Dodds","Female","Jane ",,,"Biography information for Jane Dodds","Liberal Democrat",
"http://data.parliament.uk/members/1388",,,"Dodds","Lord Dodds of Duncairn","Male","Nigel",,,"Biography information for Lord Dodds of Duncairn",,
"http://data.parliament.uk/members/1957",,,"Dodson","Lord Monk Bretton","Male","John",,,"Biography information for Lord Monk Bretton",,
"http://data.parliament.uk/members/800","Hugh","South West Hertfordshire","Dodsworth","Geoffrey Dodsworth","Male","Geoffrey",,,"Biography information for Geoffrey Dodsworth","Conservative",
"http://data.parliament.uk/members/1465",,"West Tyrone","Doherty","Mr Pat Doherty","Male","Pat",,,"Biography information for Mr Pat Doherty","Sinn Féin",
"http://data.parliament.uk/members/4166",,,"Donaghy","Baroness Donaghy","Female","Rita",,,"Biography information for Baroness Donaghy",,
"http://data.parliament.uk/members/650","Mark","Lagan Valley","Donaldson","Sir Jeffrey M Donaldson","Male","Jeffrey",,,"Biography information for Sir Jeffrey M Donaldson","Independent",
"http://data.parliament.uk/members/2712","Francis",,"Donaldson","Lord Donaldson of Lymington","Male","John",,,"Biography information for Lord Donaldson of Lymington",,
"http://data.parliament.uk/members/2863","George Stuart",,"Donaldson","Lord Donaldson of Kingsbridge","Male","John",,,"Biography information for Lord Donaldson of Kingsbridge",,
"http://data.parliament.uk/members/4377","Blair","West Aberdeenshire and Kincardine","Donaldson","Stuart Blair Donaldson","Male","Stuart",,,"Biography information for Stuart Blair Donaldson","Scottish National Party",
"http://data.parliament.uk/members/4530","Emma May Elizabeth","Chippenham","Donelan","Michelle Donelan","Female","Michelle",,,"Biography information for Michelle Donelan","Conservative",
"http://data.parliament.uk/members/586","Harold","Central Ayrshire","Donohoe","Mr Brian H. Donohoe","Male","Brian",,,"Biography information for Mr Brian H. Donohoe","Labour",
"http://data.parliament.uk/members/2709",,,"Donoughue","Lord Donoughue","Male","Bernard",,,"Biography information for Lord Donoughue",,
"http://data.parliament.uk/members/4197","Deirdre",,"Doocey","Baroness Doocey","Female","Elizabeth",,,"Biography information for Baroness Doocey",,
"http://data.parliament.uk/members/4736","Michael","Angus","Doogan","Dave Doogan","Male","David",,,"Biography information for Dave Doogan","Scottish National Party","https://twitter.com/davedoogansnp"
"http://data.parliament.uk/members/570",,"Aberdeen North","Doran","Mr Frank Doran","Male","Frank",,,"Biography information for Mr Frank Doran","Labour",
"http://data.parliament.uk/members/4740","Hopkins","Ayr, Carrick and Cumnock","Dorans","Allan Dorans","Male","Allan",,,"Biography information for Allan Dorans","Scottish National Party",
"http://data.parliament.uk/members/2700","Donkin",,"Dormand","Lord Dormand of Easington","Male","John",,,"Biography information for Lord Dormand of Easington",,
"http://data.parliament.uk/members/801","Donkin","Easington","Dormand","Jack Dormand","Male","John",,,"Biography information for Jack Dormand","Labour",
"http://data.parliament.uk/members/2707",,,"Dormer","Lord Dormer","Male","Geoffrey",,,"Biography information for Lord Dormer",,
"http://data.parliament.uk/members/2931","Spencer Philip",,"Dormer","Lord Dormer","Male","Joseph",,,"Biography information for Lord Dormer",,
"http://data.parliament.uk/members/336","James","Charnwood","Dorrell","Mr Stephen Dorrell","Male","Stephen",,,"Biography information for Mr Stephen Dorrell","Conservative",
"http://data.parliament.uk/members/1481","Vanessa","Mid Bedfordshire","Dorries","Ms Nadine Dorries","Female","Nadine",,,"Biography information for Ms Nadine Dorries","Conservative",
"http://data.parliament.uk/members/4452","Daniel","St Austell and Newquay","Double","Steve Double","Male","Stephen",,,"Biography information for Steve Double","Conservative",
"http://data.parliament.uk/members/4264","John","Cardiff South and Penarth","Doughty","Stephen Doughty","Male","Stephen",,,"Biography information for Stephen Doughty","Labour (Co-op)","https://twitter.com/SDoughtyMP"
"http://data.parliament.uk/members/1422","Kathleen","Guildford","Doughty","Sue Doughty","Female","Susan",,,"Biography information for Sue Doughty","Liberal Democrat",
"http://data.parliament.uk/members/3256","Harrington Angus",,"Douglas","The Marquess of Queensberry","Male","David",,,"Biography information for The Marquess of Queensberry",,
"http://data.parliament.uk/members/1898",,,"Douglas","The Earl of Morton","Male","John",,,"Biography information for The Earl of Morton",,
"http://data.parliament.uk/members/1050","Giles","Dunfermline West","Douglas","Dick Douglas","Male","Richard",,,"Biography information for Dick Douglas","Scottish National Party",
"http://data.parliament.uk/members/2657",,,"Douglas-Hamilton","The Duke of Hamilton and Brandon","Male","Douglas",,,"Biography information for The Duke of Hamilton and Brandon",,
"http://data.parliament.uk/members/2960","Nigel",,"Douglas-Hamilton","The Earl of Selkirk","Male","George",,,"Biography information for The Earl of Selkirk",,
"http://data.parliament.uk/members/802",,,"Douglas-Hamilton","Lord Selkirk of Douglas","Male","James",,,"Biography information for Lord Selkirk of Douglas",,
"http://data.parliament.uk/members/2938","Frederick",,"Douglas-Home","Lord Home of the Hirsel","Male","Alexander",,,"Biography information for Lord Home of the Hirsel",,
"http://data.parliament.uk/members/2007",,,"Douglas-Home","The Earl of Home","Male","David",,,"Biography information for The Earl of Home",,
"http://data.parliament.uk/members/2726",,,"Douglas-Home","Baroness Dacre","Female","Rachel",,,"Biography information for Baroness Dacre",,
"http://data.parliament.uk/members/803","Leslie Home","Merton, Mitcham & Morden","Douglas-Mann","Bruce Douglas-Mann","Male","Bruce",,,"Biography information for Bruce Douglas-Mann","Social Democratic Party",
"http://data.parliament.uk/members/5006",,,"Douglas-Miller","Lord Douglas-Miller","Male","Robert",,,"Biography information for Lord Douglas-Miller",,
"http://data.parliament.uk/members/3158","Frank",,"Douglas-Pennant","Lord Penrhyn","Male","Malcolm",,,"Biography information for Lord Penrhyn",,
"http://data.parliament.uk/members/1953","John Barrington",,"Douglas-Scott-Montagu","Lord Montagu of Beaulieu","Male","Edward",,,"Biography information for Lord Montagu of Beaulieu",,
"http://data.parliament.uk/members/683",,"Chorley","Dover","Den Dover","Male","Den",,,"Biography information for Den Dover","Conservative",
"http://data.parliament.uk/members/3843","Graham",,"Dow","The Lord Bishop of Carlisle","Male","Geoffrey",,,"Biography information for The Lord Bishop of Carlisle",,
"http://data.parliament.uk/members/189","Patrick","Lewisham West and Penge","Dowd","Jim Dowd","Male","James",,,"Biography information for Jim Dowd","Labour",
"http://data.parliament.uk/members/4397","Christopher","Bootle","Dowd","Peter Dowd","Male","Peter",,,"Biography information for Peter Dowd","Labour","https://twitter.com/peter_dowd"
"http://data.parliament.uk/members/4441","James","Hertsmere","Dowden","Oliver Dowden","Male","Oliver","www.oliverdowden.com","http://www.oliverdowden.com/","Biography information for Oliver Dowden","Conservative",
"http://data.parliament.uk/members/3081","hugh Tremenheere",,"Dowding","Lord Dowding","Male","Derek",,,"Biography information for Lord Dowding",,
"http://data.parliament.uk/members/2715","Hugh Tremenheere",,"Dowding","Lord Dowding","Male","Piers",,,"Biography information for Lord Dowding",,
"http://data.parliament.uk/members/4063",,"West Dunbartonshire","Doyle","Gemma Doyle","Female","Gemma",,,"Biography information for Gemma Doyle","Labour (Co-op)",
"http://data.parliament.uk/members/4065",,"Thurrock","Doyle-Price","Dame Jackie Doyle-Price","Female","Jacqueline",,,"Biography information for Dame Jackie Doyle-Price","Conservative",
"http://data.parliament.uk/members/4155","Lesley Patricia",,"Drake","Baroness Drake","Female","Jean",,,"Biography information for Baroness Drake",,
"http://data.parliament.uk/members/3669",,,"Drayson","Lord Drayson","Male","Paul",,,"Biography information for Lord Drayson",,
"http://data.parliament.uk/members/252",,"Stroud","Drew","Dr David Drew","Male","David",,,"Biography information for Dr David Drew","Labour (Co-op)",
"http://data.parliament.uk/members/3913","Eugene Joseph","Birmingham, Erdington","Dromey","Jack Dromey","Male","John",,,"Biography information for Jack Dromey","Labour",
"http://data.parliament.uk/members/263","Kate","South Swindon","Drown","Julia Drown","Female","Julia",,,"Biography information for Julia Drown","Labour",
"http://data.parliament.uk/members/4459","Jane Beatrix","Meon Valley","Drummond","Mrs Flick Drummond","Female","Felicia",,,"Biography information for Mrs Flick Drummond","Conservative",
"http://data.parliament.uk/members/3155","David",,"Drummond","Earl of Perth","Male","John",,,"Biography information for Earl of Perth",,
"http://data.parliament.uk/members/2217","Cherry",,"Drummond of Megginch","Baroness Strange","Female","Jean",,,"Biography information for Baroness Strange",,
"http://data.parliament.uk/members/805",,,"Dubs","Lord Dubs","Male","Alfred",,,"Biography information for Lord Dubs",,
"http://data.parliament.uk/members/1559","Philip","Rochford and Southend East","Duddridge","Sir James Duddridge","Male","James",,,"Biography information for Sir James Duddridge","Conservative",
"http://data.parliament.uk/members/4616","Clare","Canterbury","Duffield","Rosie Duffield","Female","Rosemary","www.rosieduffieldmp.co.uk","http://www.rosieduffieldmp.co.uk/","Biography information for Rosie Duffield","Labour","https://twitter.com/RosieDuffield1"
"http://data.parliament.uk/members/806","Edward Patrick","Sheffield, Attercliffe","Duffy","Sir Patrick Duffy","Male","Albert",,,"Biography information for Sir Patrick Duffy","Labour",
"http://data.parliament.uk/members/3380",,,"Dugdale","Lord Crathorne","Male","Charles",,,"Biography information for Lord Crathorne",,
"http://data.parliament.uk/members/3916",,"Barnsley East","Dugher","Michael Dugher","Male","Michael",,,"Biography information for Michael Dugher","Labour",
"http://data.parliament.uk/members/4606","James","Banff and Buchan","Duguid","David Duguid","Male","David",,,"Biography information for David Duguid","Conservative",
"http://data.parliament.uk/members/1942",,,"Duke","Lord Merrivale","Male","Jack",,,"Biography information for Lord Merrivale",,
"http://data.parliament.uk/members/343","James Carter","Rutland and Melton","Duncan","Sir Alan Duncan","Male","Alan",,,"Biography information for Sir Alan Duncan","Conservative",
"http://data.parliament.uk/members/4686",,,"Duncan","Lord Duncan of Springbank","Male","Ian",,,"Biography information for Lord Duncan of Springbank",,
"http://data.parliament.uk/members/1417","John","Galloway & Upper Nithsdale","Duncan","Mr Peter Duncan","Male","Peter",,,"Biography information for Mr Peter Duncan","Conservative",
"http://data.parliament.uk/members/152","Iain","Chingford and Woodford Green","Duncan Smith","Sir Iain Duncan Smith","Male","George","www.iainduncansmith.org.uk","http://www.iainduncansmith.org.uk/","Biography information for Sir Iain Duncan Smith","Conservative",
"http://data.parliament.uk/members/2366","Edwin",,"Duncan-Sandys","Lord Duncan-Sandys","Male","Duncan",,,"Biography information for Lord Duncan-Sandys",,
"http://data.parliament.uk/members/2784","Antony Peter",,"Duncombe","Lord Feversham","Male","Charles",,,"Biography information for Lord Feversham",,
"http://data.parliament.uk/members/2329","Aldred Mervyn",,"Dundas","The Marquess of Zetland","Male","Lawrence",,,"Biography information for The Marquess of Zetland",,
"http://data.parliament.uk/members/1757","Mark",,"Dundas","The Marquess of Zetland","Male","Lawrence",,,"Biography information for The Marquess of Zetland",,
"http://data.parliament.uk/members/1945",,,"Dundas","The Viscount Melville","Male","Robert",,,"Biography information for The Viscount Melville",,
"http://data.parliament.uk/members/4534",,,"Dunlop","Lord Dunlop","Male","Andrew",,,"Biography information for Lord Dunlop",,
"http://data.parliament.uk/members/807","E","Mid Ulster","Dunlop","John Dunlop","Male","John",,,"Biography information for John Dunlop","United Ulster Unionist Party",
"http://data.parliament.uk/members/1015","Anthony","Liverpool, Kirkdale","Dunn","James Dunn","Male","James",,,"Biography information for James Dunn","Social Democratic Party",
"http://data.parliament.uk/members/2797",,,"Dunn","Baroness Dunn","Female","Lydia",,,"Biography information for Baroness Dunn",,
"http://data.parliament.uk/members/1194","John","Dartford","Dunn","Mr Bob Dunn","Male","Robert",,,"Biography information for Mr Bob Dunn","Conservative",
"http://data.parliament.uk/members/808","Francis","Glasgow, Pollok","Dunnachie","Jimmy Dunnachie","Male","James",,,"Biography information for Jimmy Dunnachie","Labour",
"http://data.parliament.uk/members/1542","Martin","Ludlow","Dunne","Philip Dunne","Male","Philip",,,"Biography information for Philip Dunne","Conservative",
"http://data.parliament.uk/members/809","Jacob","Nottingham East","Dunnett","Jack Dunnett","Male","John",,,"Biography information for Jack Dunnett","Labour",
"http://data.parliament.uk/members/426","Patricia","Crewe & Nantwich","Dunwoody","Mrs Gwyneth Dunwoody","Female","Gwyneth",,,"Biography information for Mrs Gwyneth Dunwoody","Labour",
"http://data.parliament.uk/members/2451",,,"Durant","Lord Aldenham","Male","Antony",,,"Biography information for Lord Aldenham",,
"http://data.parliament.uk/members/1054","Anthony Bevis","Reading West","Durant","Sir Anthony Durant","Male","Robert",,,"Biography information for Sir Anthony Durant","Conservative",
"http://data.parliament.uk/members/1594","Mark","Foyle","Durkan","Mark Durkan","Male","John",,,"Biography information for Mark Durkan","Social Democratic & Labour Party",
"http://data.parliament.uk/members/4995",,"Somerton and Frome","Dyke","Sarah Dyke","Female","Sarah",,,"Biography information for Sarah Dyke","Liberal Democrat",
"http://data.parliament.uk/members/810",,,"Dykes","Lord Dykes","Male","Hugh",,,"Biography information for Lord Dykes",,
"http://data.parliament.uk/members/811",,"Midlothian","Eadie","Alex Eadie","Male","Alexander",,,"Biography information for Alex Eadie","Labour",
"http://data.parliament.uk/members/2235",,,"Eady","Lord Swinfen","Male","Roger",,,"Biography information for Lord Swinfen",,
"http://data.parliament.uk/members/491",,"Wallasey","Eagle","Dame Angela Eagle","Female","Angela","www.angelaeagle.co.uk","http://www.angelaeagle.co.uk/","Biography information for Dame Angela Eagle","Labour","https://twitter.com/angelaeagle"
"http://data.parliament.uk/members/483",,"Garston and Halewood","Eagle","Maria Eagle","Female","Maria",,,"Biography information for Maria Eagle","Labour","https://twitter.com/meaglemp"
"http://data.parliament.uk/members/2793",,,"Eames","Lord Eames","Male","Robert",,,"Biography information for Lord Eames",,
"http://data.parliament.uk/members/2315","Richard Gordon",,"Eastaugh","The Lord Bishop of Hereford","Male","John",,,"Biography information for The Lord Bishop of Hereford",,
"http://data.parliament.uk/members/812",,"Manchester, Blackley","Eastham","Ken Eastham","Male","Kenneth",,,"Biography information for Ken Eastham","Labour",
"http://data.parliament.uk/members/4846",,"Foyle","Eastwood","Colum Eastwood","Male","Colum",,,"Biography information for Colum Eastwood","Social Democratic & Labour Party",
"http://data.parliament.uk/members/4807","Simon","Dewsbury","Eastwood","Mark Eastwood","Male","Mark",,,"Biography information for Mark Eastwood","Conservative",
"http://data.parliament.uk/members/4184",,,"Eaton","Baroness Eaton","Female","Ellen",,,"Biography information for Baroness Eaton",,
"http://data.parliament.uk/members/2802",,,"Eatwell","Lord Eatwell","Male","John",,,"Biography information for Lord Eatwell",,
"http://data.parliament.uk/members/2447",,,"Eccles","Viscount Eccles","Male"," John",,,"Biography information for Viscount Eccles",,
"http://data.parliament.uk/members/2791","McAdam",,"Eccles","Viscount Eccles","Male","David",,,"Biography information for Viscount Eccles",,
"http://data.parliament.uk/members/2790",,,"Eccles","Baroness Eccles of Moulton","Female","Diana",,,"Biography information for Baroness Eccles of Moulton",,
"http://data.parliament.uk/members/2455","George",,"Eden","Lord Auckland","Male","Ian",,,"Biography information for Lord Auckland",,
"http://data.parliament.uk/members/813",,,"Eden","Lord Eden of Winton","Male","John",,,"Biography information for Lord Eden of Winton",,
"http://data.parliament.uk/members/2454","Richard",,"Eden","Earl Attlee","Male","Martin",,,"Biography information for Earl Attlee",,
"http://data.parliament.uk/members/2616",,,"Eden","Lord Henley","Male","Oliver",,,"Biography information for Lord Henley",,
"http://data.parliament.uk/members/3443","Ian Burnard",,"Eden","Lord Auckland","Male","Robert",,,"Biography information for Lord Auckland",,
"http://data.parliament.uk/members/1903",,,"Edgcumbe","The Earl of Mount Edgcumbe","Male","Robert",,,"Biography information for The Earl of Mount Edgcumbe",,
"http://data.parliament.uk/members/1640",,"Aldridge-Brownhills","Edge","Geoffrey Edge","Male","Geoffrey",,,"Biography information for Geoffrey Edge","Labour",
"http://data.parliament.uk/members/4213",,,"Edmiston","Lord Edmiston","Male","Robert",,,"Biography information for Lord Edmiston",,
"http://data.parliament.uk/members/2111","Cyril",,"Edmondson","The Lord Sandford","Male","John",,,"Biography information for The Lord Sandford",,
"http://data.parliament.uk/members/3062","Edmund",,"Edmund-Davies","Lord Edmund-Davies","Male","Herbert",,,"Biography information for Lord Edmund-Davies",,
"http://data.parliament.uk/members/1985",,,"Edwardes","The Lord Kensington","Male","Hugh",,,"Biography information for The Lord Kensington",,
"http://data.parliament.uk/members/3943","Jonathan ","Carmarthen East and Dinefwr","Edwards","Jonathan Edwards","Male","David",,,"Biography information for Jonathan Edwards","Independent",
"http://data.parliament.uk/members/2845","Cyril Boyd",,"Edwards","Lord Chelmer","Male","Eric",,,"Biography information for Lord Chelmer",,
"http://data.parliament.uk/members/543","William Edmund","Monmouth","Edwards","Mr Huw Edwards","Male","Huw",,,"Biography information for Mr Huw Edwards","Labour",
"http://data.parliament.uk/members/1052",,"Wolverhampton South East","Edwards","Robert Edwards","Male","Robert",,,"Biography information for Robert Edwards","Labour (Co-op)",
"http://data.parliament.uk/members/1058","Nicholas",,"Edwards","Lord Crickhowell","Male","Roger",,,"Biography information for Lord Crickhowell",,
"http://data.parliament.uk/members/4808","Rosamond","Rushcliffe","Edwards","Ruth Edwards","Female","Ruth",,,"Biography information for Ruth Edwards","Conservative",
"http://data.parliament.uk/members/5001","Siena","Tamworth","Edwards","Sarah Edwards","Female","Sarah",,,"Biography information for Sarah Edwards","Labour",
"http://data.parliament.uk/members/165","Stanley","Eltham","Efford","Clive Efford","Male","Clive","www.cliveefford.org.uk","http://www.cliveefford.org.uk/","Biography information for Clive Efford","Labour","https://twitter.com/CliveEfford"
"http://data.parliament.uk/members/5010",,"Kingswood","Egan","Damien Egan","Male","Damien",,,"Biography information for Damien Egan","Labour",
"http://data.parliament.uk/members/2230","Sutherland",,"Egerton","Duke of Sutherland","Male","John",,,"Biography information for Duke of Sutherland",,
"http://data.parliament.uk/members/1764","William Arthur John",,"Egerton","Earl of Wilton","Male","Seymour",,,"Biography information for Earl of Wilton",,
"http://data.parliament.uk/members/814","John Crommelin","Enfield North","Eggar","Tim Eggar","Male","Timothy",,,"Biography information for Tim Eggar","Conservative",
"http://data.parliament.uk/members/2481",,,"Elder","Lord Elder","Male","Thomas",,,"Biography information for Lord Elder",,
"http://data.parliament.uk/members/2384","Richard Michael",,"Eliot","The Earl of St. Germans","Male","Nicholas",,,"Biography information for The Earl of St. Germans",,
"http://data.parliament.uk/members/2157",,,"Eliot","The Earl of St. Germans","Male","Peregrine",,,"Biography information for The Earl of St. Germans",,
"http://data.parliament.uk/members/2816",,,"Elis-Thomas","Lord Elis-Thomas","Male","Dafydd",,,"Biography information for Lord Elis-Thomas",,
"http://data.parliament.uk/members/2814","Louie",,"Elles","Baroness Elles","Female","Diana",,,"Biography information for Baroness Elles",,
"http://data.parliament.uk/members/815","Daniel Hope","Blackpool North","Elletson","Harold Elletson","Male","Harold",,,"Biography information for Harold Elletson","Conservative",
"http://data.parliament.uk/members/3004",,,"Elliot","Baroness Elliot of Harwood","Female","Katharine",,,"Biography information for Baroness Elliot of Harwood",,
"http://data.parliament.uk/members/4952",,,"Elliot-Murray-Kynynmound","The Earl of Minto","Male","Gilbert",,,"Biography information for The Earl of Minto",,
"http://data.parliament.uk/members/1964","Edward George Lariston",,"Elliot-Murray-Kynynmound","Earl of Minto","Male","Gilbert",,,"Biography information for Earl of Minto",,
"http://data.parliament.uk/members/4127",,,"Elliott","Baroness Elliott of Whitburn Bay","Female","Julie",,,"Biography information for Baroness Elliott of Whitburn Bay",,
"http://data.parliament.uk/members/5008",,,"Elliott","Lord Elliott of Mickle Fell","Male","Matthew",,,"Biography information for Lord Elliott of Mickle Fell",,
"http://data.parliament.uk/members/816","William",,"Elliott","Lord Elliott of Morpeth","Male","Robert",,,"Biography information for Lord Elliott of Morpeth",,
"http://data.parliament.uk/members/4367",,,"Elliott","Lord Elliott of Ballinamallard","Male","Tom",,,"Biography information for Lord Elliott of Ballinamallard",,
"http://data.parliament.uk/members/2468","Humphrey Felton",,"Ellis","Lord Seaford","Male","Colin",,,"Biography information for Lord Seaford",,
"http://data.parliament.uk/members/1641",,"Brigg & Scunthorpe","Ellis","John Ellis","Male","John",,,"Biography information for John Ellis","Labour",
"http://data.parliament.uk/members/4116","Tyrone","Northampton North","Ellis","Sir Michael Ellis","Male","Michael",,,"Biography information for Sir Michael Ellis","Conservative",
"http://data.parliament.uk/members/1127","Joseph","North East Derbyshire","Ellis","Ray Ellis","Male","Raymond",,,"Biography information for Ray Ellis","Labour",
"http://data.parliament.uk/members/1057","Thomas","Wrexham","Ellis","Tom Ellis","Male","Robert",,,"Biography information for Tom Ellis","Social Democratic Party",
"http://data.parliament.uk/members/3918",,"Battersea","Ellison","Jane Ellison","Female","Jane ",,,"Biography information for Jane Ellison","Conservative",
"http://data.parliament.uk/members/484","Joyce","Liverpool, Riverside","Ellman","Dame Louise Ellman","Female","Louise",,,"Biography information for Dame Louise Ellman","Independent",
"http://data.parliament.uk/members/1487","Martin","Bournemouth East","Ellwood","Mr Tobias Ellwood","Male","Tobias",,,"Biography information for Mr Tobias Ellwood","Conservative",
"http://data.parliament.uk/members/4572","Philip James","Ogmore","Elmore","Chris Elmore","Male","Christopher",,,"Biography information for Chris Elmore","Labour","https://twitter.com/cpjelmore"
"http://data.parliament.uk/members/3971","Charles Anthony","Dover","Elphicke","Charlie Elphicke","Male","Brett",,,"Biography information for Charlie Elphicke","Independent",
