"uri","additional name","constituency > label","family name","full name","gender","given name","home page","home page > uri","label","party","twitter"
"http://data.parliament.uk/members/172","Julie","Hackney North and Stoke Newington","Abbott","Ms Diane Abbott","Female","Diane","www.dianeabbott.org.uk","http://www.dianeabbott.org.uk","Biography information for Ms Diane Abbott","Labour","https://twitter.com/HackneyAbbott"
"http://data.parliament.uk/members/1875","Huddleston",,"Abney-Hastings","Countess Loudoun","Female","Barbara",,,"Biography information for Countess Loudoun",,
"http://data.parliament.uk/members/4212","Angela Elspeth Marie","Oldham East and Saddleworth","Abrahams","Debbie Abrahams","Female","Deborah","www.debbieabrahams.org.uk","http://www.debbieabrahams.org.uk/","Biography information for Debbie Abrahams","Labour","https://twitter.com/Debbie_abrahams"
"http://data.parliament.uk/members/662",,"Torfaen","Abse","Leo Abse","Male","Leopold",,,"Biography information for Leo Abse","Labour",
"http://data.parliament.uk/members/3464","James Conrad",,"Ackner","Lord Ackner","Male","Desmond",,,"Biography information for Lord Ackner",,
"http://data.parliament.uk/members/663","Steele","Paisley North","Adams","Allen Adams","Male","Allender",,,"Biography information for Allen Adams","Labour",
"http://data.parliament.uk/members/645",,"Belfast West","Adams","Mr Gerry Adams","Male","Gerard",,,"Biography information for Mr Gerry Adams","Sinn Féin",
"http://data.parliament.uk/members/631",,,"Adams","Baroness Adams of Craigielea","Female","Katherine",,,"Biography information for Baroness Adams of Craigielea",,
"http://data.parliament.uk/members/4057",,"Selby and Ainsty","Adams","Nigel Adams","Male","Nigel",,,"Biography information for Nigel Adams","Conservative",
"http://data.parliament.uk/members/3188","Nigel Arden",,"Adderley","Lord Norton","Male","James",,,"Biography information for Lord Norton",,
"http://data.parliament.uk/members/3066","Arden",,"Adderley","Lord Norton","Male","John",,,"Biography information for Lord Norton",,
"http://data.parliament.uk/members/3131","Tonge Anthony Pellew",,"Addington","Viscount Sidmouth","Male","John",,,"Biography information for Viscount Sidmouth",,
"http://data.parliament.uk/members/3461","Matthew Wand",,"Addison","Viscount Addison","Male","William",,,"Biography information for Viscount Addison",,
"http://data.parliament.uk/members/2175",,,"Adebowale","Lord Adebowale","Male","Victor",,,"Biography information for Lord Adebowale",,
"http://data.parliament.uk/members/3002","Edgar",,"Adie","The Lord Bishop of Guildford","Male","Michael",,,"Biography information for The Lord Bishop of Guildford",,
"http://data.parliament.uk/members/665","James","Christchurch","Adley","Robert Adley","Male","Robert",,,"Biography information for Robert Adley","Conservative",
"http://data.parliament.uk/members/3743",,,"Adonis","Lord Adonis","Male","Andrew",,,"Biography information for Lord Adonis",,
"http://data.parliament.uk/members/2948","Hume",,"Adrian","Lord Adrian","Male","Richard",,,"Biography information for Lord Adrian",,
"http://data.parliament.uk/members/4639",,"Hitchin and Harpenden","Afolami","Bim Afolami","Male","Abimbola",,,"Biography information for Bim Afolami","Conservative",
"http://data.parliament.uk/members/1586",,"Windsor","Afriyie","Adam Afriyie","Male","Adam",,,"Biography information for Adam Afriyie","Conservative",
"http://data.parliament.uk/members/3847",,,"Afshar","Baroness Afshar","Female","Haleh",,,"Biography information for Baroness Afshar",,
"http://data.parliament.uk/members/3194",,,"Agar","Earl of Normanton","Male","Shaun",,,"Biography information for Earl of Normanton",,
"http://data.parliament.uk/members/4689",,,"Agnew","Lord Agnew of Oulton","Male","Theodore",,,"Biography information for Lord Agnew of Oulton",,
"http://data.parliament.uk/members/4210",,,"Ahmad","Lord Ahmad of Wimbledon","Male","Tariq",,,"Biography information for Lord Ahmad of Wimbledon",,
"http://data.parliament.uk/members/4841","Nasir","Wakefield","Ahmad Khan","Imran Ahmad Khan","Male","Imran",,,"Biography information for Imran Ahmad Khan","Independent",
"http://data.parliament.uk/members/3470",,,"Ahmed","Lord Ahmed","Male","Nazir",,,"Biography information for Lord Ahmed",,
"http://data.parliament.uk/members/4427",,"Ochil and South Perthshire","Ahmed-Sheikh","Ms Tasmina Ahmed-Sheikh","Female","Tasmina",,,"Biography information for Ms Tasmina Ahmed-Sheikh","Scottish National Party",
"http://data.parliament.uk/members/4741","Jane","Cities of London and Westminster","Aiken","Nickie Aiken","Female","Nicola ",,,"Biography information for Nickie Aiken","Conservative",
"http://data.parliament.uk/members/537","Richard","Carmarthen West & South Pembrokeshire","Ainger","Nick Ainger","Male","Nicholas",,,"Biography information for Nick Ainger","Labour",
"http://data.parliament.uk/members/99","Michael","East Surrey","Ainsworth","Mr Peter Ainsworth","Male","Peter",,,"Biography information for Mr Peter Ainsworth","Conservative",
"http://data.parliament.uk/members/306","William","Coventry North East","Ainsworth","Mr Bob Ainsworth","Male","Robert",,,"Biography information for Mr Bob Ainsworth","Labour",
"http://data.parliament.uk/members/3056","Josceline Barbara Neave",,"Airey","Baroness Airey of Abingdon","Female","Diana",,,"Biography information for Baroness Airey of Abingdon",,
"http://data.parliament.uk/members/735","William Patrick","South Thanet","Aitken","Jonathan Aitken","Male","Jonathan",,,"Biography information for Jonathan Aitken","Conservative",
"http://data.parliament.uk/members/3525",,,"Aitken","Lord Beaverbrook","Male","Maxwell",,,"Biography information for Lord Beaverbrook",,
"http://data.parliament.uk/members/3400","George",,"Akers-Douglas","Viscount Chilston","Male","Alastair",,,"Biography information for Viscount Chilston",,
"http://data.parliament.uk/members/3478",,,"Alderdice","Lord Alderdice","Male","John",,,"Biography information for Lord Alderdice",,
"http://data.parliament.uk/members/4069","James Guy","Waveney","Aldous","Peter Aldous","Male","Peter",,,"Biography information for Peter Aldous","Conservative",
"http://data.parliament.uk/members/2651","Robin",,"Alers Hankey","Lord Hankey","Male","Donald",,,"Biography information for Lord Hankey",,
"http://data.parliament.uk/members/1535","Grian","Inverness, Nairn, Badenoch and Strathspey","Alexander","Danny Alexander","Male","Daniel",,,"Biography information for Danny Alexander","Liberal Democrat",
"http://data.parliament.uk/members/632","Garven","Paisley and Renfrewshire South","Alexander","Mr Douglas Alexander","Male","Douglas",,,"Biography information for Mr Douglas Alexander","Labour",
"http://data.parliament.uk/members/4038",,"Lewisham East","Alexander","Heidi Alexander","Female","Heidi",,,"Biography information for Heidi Alexander","Labour",
"http://data.parliament.uk/members/974","Thain","Newark","Alexander","Richard Alexander","Male","Richard",,,"Biography information for Richard Alexander","Conservative",
"http://data.parliament.uk/members/3486","Scott",,"Alexander","Lord Alexander of Weedon","Male","Robert",,,"Biography information for Lord Alexander of Weedon",,
"http://data.parliament.uk/members/3462","William Desmond",,"Alexander","Earl Alexander of Tunis","Male","Shane",,,"Biography information for Earl Alexander of Tunis",,
"http://data.parliament.uk/members/5394",,,"Alexander","Baroness Alexander of Cleveden","Female","Wendy",,,"Biography information for Baroness Alexander of Cleveden",,
"http://data.parliament.uk/members/3031","Picken",,"Alexander","Lord Alexander of Potterhill","Male","William",,,"Biography information for Lord Alexander of Potterhill",,
"http://data.parliament.uk/members/4138",,"Bethnal Green and Bow","Ali","Rushanara Ali","Female","Rushanara","www.rushanaraali.org","http://www.rushanaraali.org/","Biography information for Rushanara Ali","Labour","https://twitter.com/rushanaraali"
"http://data.parliament.uk/members/4747",,"Birmingham, Hall Green","Ali","Tahir Ali","Male","Tahir",,,"Biography information for Tahir Ali","Labour",
"http://data.parliament.uk/members/4234",,,"Aline","Baroness Lister of Burtersett","Female","Margot",,,"Biography information for Baroness Lister of Burtersett",,
"http://data.parliament.uk/members/736","James Hugh","Selby","Alison","Michael Alison","Male","Michael",,,"Biography information for Michael Alison","Conservative",
"http://data.parliament.uk/members/4411",,"Telford","Allan","Lucy Allan","Female","Lucy",,,"Biography information for Lucy Allan","Independent",
"http://data.parliament.uk/members/397",,,"Allan","Lord Allan of Hallam","Male","Richard",,,"Biography information for Lord Allan of Hallam",,
"http://data.parliament.uk/members/1611",,"Hemel Hempstead","Allason","James Allason","Male","James",,,"Biography information for James Allason","Conservative",
"http://data.parliament.uk/members/730","William Simon","Torbay","Allason","Rupert Allason","Male","Rupert",,,"Biography information for Rupert Allason","Conservative",
"http://data.parliament.uk/members/737","Julian","Salford East","Allaun","Frank Allaun","Male","Frank",,,"Biography information for Frank Allaun","Labour",
"http://data.parliament.uk/members/4304",,,"Allen","Lord Allen of Kensington","Male","Charles",,,"Biography information for Lord Allen of Kensington",,
"http://data.parliament.uk/members/3375",,,"Allen","Lord Croham","Male","Douglas",,,"Biography information for Lord Croham",,
"http://data.parliament.uk/members/364","William","Nottingham North","Allen","Mr Graham Allen","Male","Graham",,,"Biography information for Mr Graham Allen","Labour",
"http://data.parliament.uk/members/4516",,"South Cambridgeshire","Allen","Heidi Allen","Female","Heidi-Suzanne",,,"Biography information for Heidi Allen","Liberal Democrat",
"http://data.parliament.uk/members/3485",,,"Allen","Lord Allen of Abbeydale","Male","Philip",,,"Biography information for Lord Allen of Abbeydale",,
"http://data.parliament.uk/members/3484",,,"Allenby","Viscount Allenby of Megiddo","Male","Michael",,,"Biography information for Viscount Allenby of Megiddo",,
"http://data.parliament.uk/members/3482",,,"Alli","Lord Alli","Male","Waheed",,,"Biography information for Lord Alli",,
"http://data.parliament.uk/members/3710",,,"Alliance","Lord Alliance","Male","David",,,"Biography information for Lord Alliance",,
"http://data.parliament.uk/members/4573","Chantelle","Tooting","Allin-Khan","Dr Rosena Allin-Khan","Female","Rosena","www.drrosena.co.uk","http://www.drrosena.co.uk/","Biography information for Dr Rosena Allin-Khan","Labour","https://twitter.com/DrRosena"
"http://data.parliament.uk/members/2645",,,"Allsopp","Lord Hindlip","Male","Charles",,,"Biography information for Lord Hindlip",,
"http://data.parliament.uk/members/3006","Richard",,"Allsopp","Lord Hindlip","Male","Henry",,,"Biography information for Lord Hindlip",,
"http://data.parliament.uk/members/3481","James McCall",,"Alport","Lord Alport","Male","Cuthbert",,,"Biography information for Lord Alport",,
"http://data.parliament.uk/members/4533",,,"Altmann","Baroness Altmann","Female","Rosalind",,,"Biography information for Baroness Altmann",,
"http://data.parliament.uk/members/738",,,"Alton","Lord Alton of Liverpool","Male","David","davidalton.net","http://davidalton.net/","Biography information for Lord Alton of Liverpool",,
"http://data.parliament.uk/members/2327","Pelham Leigh",,"Aman","Lord Marley","Male","Godfrey",,,"Biography information for Lord Marley",,
"http://data.parliament.uk/members/2919",,,"Amery","Lord Amery of Lustleigh","Male","Julian",,,"Biography information for Lord Amery of Lustleigh",,
"http://data.parliament.uk/members/4667","Lee","Weaver Vale","Amesbury","Mike Amesbury","Male","Michael",,,"Biography information for Mike Amesbury","Labour","https://twitter.com/MikeAmesburymp"
"http://data.parliament.uk/members/44","Anthony Andrew","Southend West","Amess","Sir David Amess","Male","David",,,"Biography information for Sir David Amess","Conservative",
"http://data.parliament.uk/members/1212","Thomas","Hexham","Amos","Mr Alan Amos","Male","Alan",,,"Biography information for Mr Alan Amos","Conservative",
"http://data.parliament.uk/members/3477",,,"Amos","Baroness Amos","Female","Valerie",,,"Biography information for Baroness Amos",,
"http://data.parliament.uk/members/259",,,"Ancram","The Marquess of Lothian","Male","Michael",,,"Biography information for The Marquess of Lothian",,
"http://data.parliament.uk/members/1486",,"Blaydon","Anderson","Mr David Anderson","Male","David",,,"Biography information for Mr David Anderson","Labour",
"http://data.parliament.uk/members/4705",,,"Anderson","Lord Anderson of Ipswich","Male","David",,,"Biography information for Lord Anderson of Ipswich",,
"http://data.parliament.uk/members/2567","Alastair Pearson",,"Anderson","Viscount Waverley","Male","David",,,"Biography information for Viscount Waverley",,
"http://data.parliament.uk/members/568",,,"Anderson","Lord Anderson of Swansea","Male","Donald",,,"Biography information for Lord Anderson of Swansea",,
"http://data.parliament.uk/members/4788",,"Putney","Anderson","Fleur Anderson","Female","Fleur",,,"Biography information for Fleur Anderson","Labour",
"http://data.parliament.uk/members/475",,"Rossendale & Darwen","Anderson","Janet Anderson","Female","Janet",,,"Biography information for Janet Anderson","Labour",
"http://data.parliament.uk/members/1744",,,"Anderson","Viscount Waverley","Male","John","www.lordwaverley.com","http://www.lordwaverley.com/","Biography information for Viscount Waverley",,
"http://data.parliament.uk/members/4743",,"Ashfield","Anderson","Lee Anderson","Male","Lee",,,"Biography information for Lee Anderson","Reform UK",
"http://data.parliament.uk/members/4742","Paul","Wolverhampton South West","Anderson","Stuart Anderson","Male","Stuart",,,"Biography information for Stuart Anderson","Conservative",
"http://data.parliament.uk/members/4032","James","Pudsey","Andrew","Stuart Andrew","Male","Stuart",,,"Biography information for Stuart Andrew","Conservative","https://twitter.com/stuartandrew"
"http://data.parliament.uk/members/2534",,,"Andrews","Baroness Andrews","Female","Elizabeth",,,"Biography information for Baroness Andrews",,
"http://data.parliament.uk/members/3474",,,"Anelay","Baroness Anelay of St Johns","Female","Joyce",,,"Biography information for Baroness Anelay of St Johns",,
"http://data.parliament.uk/members/3445","Gilroy",,"Annan","Lord Annan","Male","Noel",,,"Biography information for Lord Annan",,
"http://data.parliament.uk/members/4512",,"Eastbourne","Ansell","Caroline Ansell","Female","Caroline",,,"Biography information for Caroline Ansell","Conservative",
"http://data.parliament.uk/members/2030","Patrick John",,"Anson","Earl of Lichfield","Male","Thomas",,,"Biography information for Earl of Lichfield",,
"http://data.parliament.uk/members/4623","Louise","Gower","Antoniazzi","Tonia Antoniazzi","Female","Antonia","www.toniaantoniazzi.co.uk","http://www.toniaantoniazzi.co.uk/","Biography information for Tonia Antoniazzi","Labour","https://twitter.com/ToniaAntoniazzi"
"http://data.parliament.uk/members/56",,,"Arbuthnot","Lord Arbuthnot of Edrom","Male","James",,,"Biography information for Lord Arbuthnot of Edrom",,
"http://data.parliament.uk/members/3460",,,"Arbuthnott","Viscount Arbuthnott","Male","John",,,"Biography information for Viscount Arbuthnott",,
"http://data.parliament.uk/members/1612",,,"Archer","Lord Archer of Weston-Super-Mare","Male","Jeffrey",,,"Biography information for Lord Archer of Weston-Super-Mare",,
"http://data.parliament.uk/members/741","Kingsley",,"Archer","Lord Archer of Sandwell","Male","Peter",,,"Biography information for Lord Archer of Sandwell",,
"http://data.parliament.uk/members/3032","John",,"Archere","Earl of Amherst","Male","Jeffery",,,"Biography information for Earl of Amherst",,
"http://data.parliament.uk/members/2985","Cowburn",,"Ardwick","Lord Ardwick","Male","John",,,"Biography information for Lord Ardwick",,
"http://data.parliament.uk/members/4362","John Comport","Charnwood","Argar","Edward Argar","Male","Edward",,,"Biography information for Edward Argar","Conservative",
"http://data.parliament.uk/members/4387",,"Dumfries and Galloway","Arkless","Richard Arkless","Male","Richard",,,"Biography information for Richard Arkless","Scottish National Party",
"http://data.parliament.uk/members/968",,"North West Durham","Armstrong","Ernest Armstrong","Male","Ernest",,,"Biography information for Ernest Armstrong","Labour",
"http://data.parliament.uk/members/4150",,,"Armstrong","Baroness Armstrong of Hill Top","Female","Hilary","www.hilaryarmstrong.com","http://www.hilaryarmstrong.com","Biography information for Baroness Armstrong of Hill Top",,
"http://data.parliament.uk/members/3434",,,"Armstrong","Lord Armstrong of Ilminster","Male","Robert",,,"Biography information for Lord Armstrong of Ilminster",,
"http://data.parliament.uk/members/3150",,,"Armstrong-Jones","Earl of Snowdon","Male","Antony",,,"Biography information for Earl of Snowdon",,
"http://data.parliament.uk/members/1205","Arnold","Gravesham","Arnold","Mr Jacques Arnold","Male","Jacques",,,"Biography information for Mr Jacques Arnold","Conservative",
"http://data.parliament.uk/members/973","Richard","Hazel Grove","Arnold","Sir Thomas Arnold","Male","Thomas",,,"Biography information for Sir Thomas Arnold","Conservative",
"http://data.parliament.uk/members/2607",,,"Arthur","Lord Glenarthur","Male","Simon",,,"Biography information for Lord Glenarthur",,
"http://data.parliament.uk/members/742","Glynn","North West Leicestershire","Ashby","David Ashby","Male","David",,,"Biography information for David Ashby","Conservative",
"http://data.parliament.uk/members/3028",,,"Ashby","Lord Ashby","Male","Eric",,,"Biography information for Lord Ashby",,
"http://data.parliament.uk/members/2568",,,"Ashcroft","Lord Ashcroft","Male","Michael",,,"Biography information for Lord Ashcroft",,
"http://data.parliament.uk/members/258",,,"Ashdown","Lord Ashdown of Norton-sub-Hamdon","Male","Jeremy",,,"Biography information for Lord Ashdown of Norton-sub-Hamdon",,
"http://data.parliament.uk/members/971",,,"Ashley","Lord Ashley of Stoke","Male","Jack",,,"Biography information for Lord Ashley of Stoke",,
"http://data.parliament.uk/members/2123",,,"Ashley-Cooper","Earl of Shaftesbury","Male","Anthony",,,"Biography information for Earl of Shaftesbury",,
"http://data.parliament.uk/members/2500",,,"Ashton","Baroness Ashton of Upholland","Female","Catherine",,,"Biography information for Baroness Ashton of Upholland",,
"http://data.parliament.uk/members/358","William","Bassetlaw","Ashton","Mr Joe Ashton","Male","Joseph",,,"Biography information for Mr Joe Ashton","Labour",
"http://data.parliament.uk/members/4247",,,"Ashton","Lord Ashton of Hyde","Male","Thomas",,,"Biography information for Lord Ashton of Hyde",,
"http://data.parliament.uk/members/3436","John",,"Ashton","Lord Ashton of Hyde","Male","Thomas",,,"Biography information for Lord Ashton of Hyde",,
"http://data.parliament.uk/members/4244","Michael Graham","Leicester South","Ashworth","Jonathan Ashworth","Male","Jonathan",,,"Biography information for Jonathan Ashworth","Labour (Co-op)",
"http://data.parliament.uk/members/743","Heywood","Wansdyke","Aspinwall","Jack Aspinwall","Male","Jack",,,"Biography information for Jack Aspinwall","Conservative",
"http://data.parliament.uk/members/3178",,,"Asquith","The Earl of Oxford and Asquith","Male","Julian",,,"Biography information for The Earl of Oxford and Asquith",,
"http://data.parliament.uk/members/4343",,,"Asquith","The Earl of Oxford and Asquith","Male","Raymond",,,"Biography information for The Earl of Oxford and Asquith",,
"http://data.parliament.uk/members/3418","John",,"Assheton","Lord Clitheroe","Male","Ralph",,,"Biography information for Lord Clitheroe",,
"http://data.parliament.uk/members/2653","Delaval Henry",,"Astley","Lord Hastings","Male","Edward",,,"Biography information for Lord Hastings",,
"http://data.parliament.uk/members/3428",,,"Astor","Lord Astor of Hever","Male","John",,,"Biography information for Lord Astor of Hever",,
"http://data.parliament.uk/members/3429",,,"Astor","Viscount Astor","Male","William",,,"Biography information for Viscount Astor",,
"http://data.parliament.uk/members/224","Kathleen","Falmouth & Camborne","Atherton","Ms Candy Atherton","Female","Candice",,,"Biography information for Ms Candy Atherton","Labour",
"http://data.parliament.uk/members/4855","Elizabeth","Wrexham","Atherton","Sarah Atherton","Female","Sarah",,,"Biography information for Sarah Atherton","Conservative",
"http://data.parliament.uk/members/284","Jean Scott","Staffordshire Moorlands","Atkins","Charlotte Atkins","Female","Charlotte",,,"Biography information for Charlotte Atkins","Labour",
"http://data.parliament.uk/members/2891","Edward Gregory",,"Atkins","Lord Colnbrook","Male","Humphrey",,,"Biography information for Lord Colnbrook",,
"http://data.parliament.uk/members/970","Edward Gregory","Spelthorne","Atkins","Sir Humphrey Atkins","Male","Humphrey",,,"Biography information for Sir Humphrey Atkins","Conservative",
"http://data.parliament.uk/members/975","James","South Ribble","Atkins","Sir Robert Atkins","Male","Robert",,,"Biography information for Sir Robert Atkins","Conservative",
"http://data.parliament.uk/members/1613",,"Preston North","Atkins","Ronald Atkins","Male","Ronald",,,"Biography information for Ronald Atkins","Labour",
"http://data.parliament.uk/members/4399",,"Louth and Horncastle","Atkins","Victoria Atkins","Female","Victoria","www.victoriaatkins.org.uk","http://www.victoriaatkins.org.uk/","Biography information for Victoria Atkins","Conservative",
"http://data.parliament.uk/members/240","Anthony","Bournemouth East","Atkinson","Mr David Atkinson","Male","David",,,"Biography information for Mr David Atkinson","Conservative",
"http://data.parliament.uk/members/972",,"Tottenham","Atkinson","Norman Atkinson","Male","Norman",,,"Biography information for Norman Atkinson","Labour",
"http://data.parliament.uk/members/515","Landreth","Hexham","Atkinson","Mr Peter Atkinson","Male","Peter",,,"Biography information for Mr Peter Atkinson","Conservative",
"http://data.parliament.uk/members/3426","Samuel",,"Attenborough","Lord Attenborough","Male","Richard",,,"Biography information for Lord Attenborough",,
"http://data.parliament.uk/members/3425",,,"Attlee","Earl Attlee","Male","John",,,"Biography information for Earl Attlee",,
"http://data.parliament.uk/members/4929",,,"Atwell","The Lord Bishop of Exeter","Male","Robert",,,"Biography information for The Lord Bishop of Exeter",,
"http://data.parliament.uk/members/3518",,,"Aubrey-Fletcher","Baroness Braye","Female","Mary",,,"Biography information for Baroness Braye",,
"http://data.parliament.uk/members/1511",,,"Austin","Lord Austin of Dudley","Male","Ian",,,"Biography information for Lord Austin of Dudley",,
"http://data.parliament.uk/members/168","Eric","Erith & Thamesmead","Austin","John Austin","Male","John",,,"Biography information for John Austin","Labour",
"http://data.parliament.uk/members/2984","William",,"Aylestone","Lord Aylestone","Male","Herbert",,,"Biography information for Lord Aylestone",,
"http://data.parliament.uk/members/3451",,,"Bach","Lord Bach","Male","William",,,"Biography information for Lord Bach",,
"http://data.parliament.uk/members/3055","Martha",,"Bacon","Baroness Bacon","Female","Alice",,,"Biography information for Baroness Bacon",,
"http://data.parliament.uk/members/4798","Andrew","Orpington","Bacon","Gareth Bacon","Male","Gareth",,,"Biography information for Gareth Bacon","Conservative","https://twitter.com/garethbaconmp"
"http://data.parliament.uk/members/1451","Michael","South Norfolk","Bacon","Mr Richard Bacon","Male","Richard",,,"Biography information for Mr Richard Bacon","Conservative",
"http://data.parliament.uk/members/3450",,,"Baden-Powell","Lord Baden-Powell","Male","Robert",,,"Biography information for Lord Baden-Powell",,
"http://data.parliament.uk/members/4597","Olufunto","Saffron Walden","Badenoch","Kemi Badenoch","Female","Olukemi",,,"Biography information for Kemi Badenoch","Conservative","https://twitter.com/KemiBadenoch"
"http://data.parliament.uk/members/744","Alexander Thomas","Sunderland South","Bagier","Gordon Bagier","Male","Gordon",,,"Biography information for Gordon Bagier","Labour",
"http://data.parliament.uk/members/3449",,,"Bagot","Lord Bagot","Male","Heneage",,,"Biography information for Lord Bagot",,
"http://data.parliament.uk/members/3448",,,"Bagri","Lord Bagri","Male","Raj",,,"Biography information for Lord Bagri",,
"http://data.parliament.uk/members/3959",,"Corby","Bagshawe","Mrs Louise Mensch","Female","Louise",,,"Biography information for Mrs Louise Mensch","Conservative",
"http://data.parliament.uk/members/320","Edward","West Bromwich West","Bailey","Mr Adrian Bailey","Male","Adrian",,,"Biography information for Mr Adrian Bailey","Labour (Co-op)",
"http://data.parliament.uk/members/2609","Russell",,"Bailey","Lord Glanusk","Male","Christopher",,,"Biography information for Lord Glanusk",,
"http://data.parliament.uk/members/2841","Russell",,"Bailey","Lord Glanusk","Male","David",,,"Biography information for Lord Glanusk",,
"http://data.parliament.uk/members/2512",,,"Bailey","The Lord Bishop of Derby","Male","Jonathan",,,"Biography information for The Lord Bishop of Derby",,
"http://data.parliament.uk/members/4987",,,"Bailey","Lord Bailey of Paddington","Male","Shaun",,,"Biography information for Lord Bailey of Paddington",,
"http://data.parliament.uk/members/4757","Stephen","West Bromwich West","Bailey","Shaun Bailey","Male","Shaun",,,"Biography information for Shaun Bailey","Conservative",
"http://data.parliament.uk/members/3350",,,"Baillie","Lord Burton","Male","Michael",,,"Biography information for Lord Burton",,
