"uri","additional name","constituency > label","family name","full name","gender","given name","home page","home page > uri","label","party","twitter"
"http://data.parliament.uk/members/5019",,,"Jamieson","Lord Jamieson","Male","James",,,"Biography information for Lord Jamieson",,
"http://data.parliament.uk/members/4337",,,"Janke","Baroness Janke","Female","Barbara",,,"Biography information for Baroness Janke",,
"http://data.parliament.uk/members/879","Simon","Thurrock","Janman","Tim Janman","Male","Timothy",,,"Biography information for Tim Janman","Conservative",
"http://data.parliament.uk/members/880",,,"Janner","Lord Janner of Braunstone","Male","Greville",,,"Biography information for Lord Janner of Braunstone",,
"http://data.parliament.uk/members/3838",,,"Janvrin","Lord Janvrin","Male","Robin",,,"Biography information for Lord Janvrin",,
"http://data.parliament.uk/members/4634","Anne","Edinburgh West","Jardine","Christine Jardine","Female","Christine",,,"Biography information for Christine Jardine","Liberal Democrat","https://twitter.com/CajardineMP"
"http://data.parliament.uk/members/4243","Owen","Barnsley Central","Jarvis","Dan Jarvis","Male","Daniel",,,"Biography information for Dan Jarvis","Labour","https://twitter.com/DanJarvisMP"
"http://data.parliament.uk/members/1971","Eliot",,"Jauncey","Lord Jauncey of Tullichettle","Male","Charles",,,"Biography information for Lord Jauncey of Tullichettle",,
"http://data.parliament.uk/members/3945",,"Bromsgrove","Javid","Sir Sajid Javid","Male","Sajid",,,"Biography information for Sir Sajid Javid","Conservative",
"http://data.parliament.uk/members/2926","Patrick Thomas",,"Jay","Lord Jay","Male","Douglas",,,"Biography information for Lord Jay",,
"http://data.parliament.uk/members/881","Patrick Thomas","Battersea North","Jay","Douglas Jay","Male","Douglas",,,"Biography information for Douglas Jay","Labour",
"http://data.parliament.uk/members/1970",,,"Jay","Baroness Jay of Paddington","Female","Margaret",,,"Biography information for Baroness Jay of Paddington",,
"http://data.parliament.uk/members/3818",,,"Jay","Lord Jay of Ewelme","Male","Michael",,,"Biography information for Lord Jay of Ewelme",,
"http://data.parliament.uk/members/4498","Malcolm","North East Hampshire","Jayawardena","Mr Ranil Jayawardena","Male","Ranil",,,"Biography information for Mr Ranil Jayawardena","Conservative",
"http://data.parliament.uk/members/2903","Miles Gladwyn",,"Jebb","Lord Gladwyn","Male","Hubert",,,"Biography information for Lord Gladwyn",,
"http://data.parliament.uk/members/2610",,,"Jebb","Lord Gladwyn","Male","Miles",,,"Biography information for Lord Gladwyn",,
"http://data.parliament.uk/members/1969","Henry",,"Jeffreys","Lord Jeffreys","Male","Christopher",,,"Biography information for Lord Jeffreys",,
"http://data.parliament.uk/members/2391","George Christophers",,"Jeffreys","Lord Jeffreys","Male","Mark",,,"Biography information for Lord Jeffreys",,
"http://data.parliament.uk/members/1968",,,"Jeger","Baroness Jeger","Female","Lena",,,"Biography information for Baroness Jeger",,
"http://data.parliament.uk/members/5402","Rebecca",,"Jelley","The Lord Bishop of Coventry","Female","Sophie",,,"Biography information for The Lord Bishop of Coventry",,
"http://data.parliament.uk/members/1989","Patrick John Rushworth",,"Jellicoe","The Earl Jellicoe","Male","George",,,"Biography information for The Earl Jellicoe",,
"http://data.parliament.uk/members/4229","Caroline",,"Jenkin","Baroness Jenkin of Kennington","Female","Anne",,,"Biography information for Baroness Jenkin of Kennington",,
"http://data.parliament.uk/members/40","Christison","Harwich and North Essex","Jenkin","Sir Bernard Jenkin","Male","Bernard","www.bernardjenkinmp.com","http://www.bernardjenkinmp.com","Biography information for Sir Bernard Jenkin","Con
"http://data.parliament.uk/members/1097","Patrick Fleeming",,"Jenkin","Lord Jenkin of Roding","Male","Charles",,,"Biography information for Lord Jenkin of Roding",,
"http://data.parliament.uk/members/289","David","Tamworth","Jenkins","Mr Brian Jenkins","Male","Brian",,,"Biography information for Mr Brian Jenkins","Labour",
"http://data.parliament.uk/members/2996",,,"Jenkins","The Lord Bishop of Durham","Male","David",,,"Biography information for The Lord Bishop of Durham",,
"http://data.parliament.uk/members/1996","Gater",,"Jenkins","Lord Jenkins of Putney","Male","Hugh",,,"Biography information for Lord Jenkins of Putney",,
"http://data.parliament.uk/members/1973","Harris",,"Jenkins","Lord Jenkins of Hillhead","Male","Roy",,,"Biography information for Lord Jenkins of Hillhead",,
"http://data.parliament.uk/members/732","Harris","Glasgow, Hillhead","Jenkins","Roy Jenkins","Male","Roy",,,"Biography information for Roy Jenkins","Social Democratic Party",
"http://data.parliament.uk/members/4752","Ian","Workington","Jenkinson","Mark Jenkinson","Male","Mark",,,"Biography information for Mark Jenkinson","Conservative",
"http://data.parliament.uk/members/4490","Marie","Morley and Outwood","Jenkyns","Dame Andrea Jenkyns","Female","Andrea",,,"Biography information for Dame Andrea Jenkyns","Conservative",
"http://data.parliament.uk/members/4320","Edward","Newark","Jenrick","Robert Jenrick","Male","Robert","www.robertjenrick.com","http://www.robertjenrick.com/","Biography information for Robert Jenrick","Conservative","https://twitter.co
"http://data.parliament.uk/members/2151","George James",,"Jervis","Viscount St. Vincent","Male","Ronald",,,"Biography information for Viscount St. Vincent",,
"http://data.parliament.uk/members/2248","Herbert",,"Jessel","Lord Jessel","Male","Edward",,,"Biography information for Lord Jessel",,
"http://data.parliament.uk/members/1069","Francis Henry","Twickenham","Jessel","Toby Jessel","Male","Thomas",,,"Biography information for Toby Jessel","Conservative",
"http://data.parliament.uk/members/2528",,,"Joffe","Lord Joffe","Male","Joel",,,"Biography information for Lord Joffe",,
"http://data.parliament.uk/members/708","Thomas","Pontypridd","John","Brynmor John","Male","Brynmor",,,"Biography information for Brynmor John","Labour",
"http://data.parliament.uk/members/376","Arthur","Kingston upon Hull West and Hessle","Johnson","Alan Johnson","Male","Alan",,,"Biography information for Alan Johnson","Labour",
"http://data.parliament.uk/members/1423","Boris de Pfeffel","Uxbridge and South Ruislip","Johnson","Boris Johnson","Male","Alexander",,,"Biography information for Boris Johnson","Conservative",
"http://data.parliament.uk/members/4592","Elizabeth","Sleaford and North Hykeham","Johnson","Dr Caroline Johnson","Female","Caroline","www.carolinejohnson.co.uk","http://www.carolinejohnson.co.uk/","Biography information for Dr Carolin
"http://data.parliament.uk/members/1533","Ruth","Kingston upon Hull North","Johnson","Dame Diana Johnson","Female","Diana","www.dianajohnson.co.uk","http://www.dianajohnson.co.uk/","Biography information for Dame Diana Johnson","Labour
"http://data.parliament.uk/members/4949",,,"Johnson","Lord Johnson of Lainston","Male","Dominic ",,,"Biography information for Lord Johnson of Lainston",,
"http://data.parliament.uk/members/3970","Alan","Dartford","Johnson","Gareth Johnson","Male","Gareth",,,"Biography information for Gareth Johnson","Conservative",
"http://data.parliament.uk/members/1014",,"Kingston upon Hull West","Johnson","James Johnson","Male","James",,,"Biography information for James Johnson","Labour",
"http://data.parliament.uk/members/4039",,,"Johnson","Lord Johnson of Marylebone","Male","Jo","www.jo-johnson.com","http://www.jo-johnson.com","Biography information for Lord Johnson of Marylebone",,
"http://data.parliament.uk/members/4824","Marie","Liverpool, Riverside","Johnson","Kim Johnson","Female","Kim",,,"Biography information for Kim Johnson","Labour",
"http://data.parliament.uk/members/74","Jane","Welwyn Hatfield","Johnson","Miss Melanie Johnson","Female","Melanie",,,"Biography information for Miss Melanie Johnson","Labour",
"http://data.parliament.uk/members/1073","Hamlet","South Derby","Johnson","Walter Johnson","Male","Walter",,,"Biography information for Walter Johnson","Labour",
"http://data.parliament.uk/members/29",,"Wealden","Johnson Smith","Sir Geoffrey Johnson Smith","Male","Geoffrey",,,"Biography information for Sir Geoffrey Johnson Smith","Conservative",
"http://data.parliament.uk/members/1994",,,"Johnston","Lord Johnston of Rockport","Male","Charles",,,"Biography information for Lord Johnston of Rockport",,
"http://data.parliament.uk/members/4761","Mervyn","Wantage","Johnston","David Johnston","Male","David",,,"Biography information for David Johnston","Conservative",
"http://data.parliament.uk/members/1993","Michael",,"Joicey","Lord Joicey","Male","James",,,"Biography information for Lord Joicey",,
"http://data.parliament.uk/members/3086","Edward",,"Joicey","Lord Joicey","Male","Micheal",,,"Biography information for Lord Joicey",,
"http://data.parliament.uk/members/2018",,,"Jolliffe","Lord Hylton","Male","Raymond",,,"Biography information for Lord Hylton",,
"http://data.parliament.uk/members/4203","Anne",,"Jolly","Baroness Jolly","Female","Judith",,,"Biography information for Baroness Jolly",,
"http://data.parliament.uk/members/3996","Hanson","Harrogate and Knaresborough","Jones","Andrew Jones","Male","Andrew",,,"Biography information for Andrew Jones","Conservative",
"http://data.parliament.uk/members/5383",,,"Jones","Lord Jones of Penybont","Male","Carwyn",,,"Biography information for Lord Jones of Penybont",,
"http://data.parliament.uk/members/991",,"Burnley","Jones","Dan Jones","Male","Daniel",,,"Biography information for Dan Jones","Labour",
"http://data.parliament.uk/members/4621","Paul","Bristol North West","Jones","Darren Jones","Male","Darren","www.darren-jones.co.uk","http://www.darren-jones.co.uk/","Biography information for Darren Jones","Labour","https://twitter.co
"http://data.parliament.uk/members/1502","Ian","Clwyd West","Jones","Mr David Jones","Male","David",,,"Biography information for Mr David Jones","Conservative",
"http://data.parliament.uk/members/3775",,,"Jones","Lord Jones of Birmingham","Male","Digby",,,"Biography information for Lord Jones of Birmingham",,
"http://data.parliament.uk/members/4763","Alicia","Brecon and Radnorshire","Jones","Fay Jones","Female","Fay",,,"Biography information for Fay Jones","Conservative",
"http://data.parliament.uk/members/362","Elizabeth Ann","Newark","Jones","Ms Fiona Jones","Female","Fiona",,,"Biography information for Ms Fiona Jones","Labour",
"http://data.parliament.uk/members/2300","Elwyn",,"Jones","Lord Elwyn-Jones","Male","Frederick",,,"Biography information for Lord Elwyn-Jones",,
"http://data.parliament.uk/members/4501",,"Merthyr Tydfil and Rhymney","Jones","Gerald Jones","Male","Gerald","www.geraldjones.co.uk","http://www.geraldjones.co.uk/","Biography information for Gerald Jones","Labour","https://twitter.co
"http://data.parliament.uk/members/3999","Peter","Hyndburn","Jones","Graham P Jones","Male","Graham",,,"Biography information for Graham P Jones","Labour",
"http://data.parliament.uk/members/1147","Haydn","Cardiff North","Jones","Gwilym Jones","Male","Gwilym",,,"Biography information for Gwilym Jones","Conservative",
"http://data.parliament.uk/members/1659",,"Carmarthen","Jones","Gwynoro Jones","Male","Gwynoro",,,"Biography information for Gwynoro Jones","Labour",
"http://data.parliament.uk/members/432","Mary","Warrington North","Jones","Helen Jones","Female","Helen",,,"Biography information for Helen Jones","Labour",
"http://data.parliament.uk/members/550","Wyn","Ynys Môn","Jones","Mr Ieuan Wyn Jones","Male","Ieuan",,,"Biography information for Mr Ieuan Wyn Jones","Plaid Cymru",
"http://data.parliament.uk/members/3636",,,"Jones","The Lord Bishop of Liverpool","Male","James",,,"Biography information for The Lord Bishop of Liverpool",,
"http://data.parliament.uk/members/4297",,,"Jones","Baroness Jones of Moulsecoomb","Female","Jennifer",,,"Biography information for Baroness Jones of Moulsecoomb",,
"http://data.parliament.uk/members/323","Grace","Wolverhampton South West","Jones","Ms Jenny Jones","Female","Jennifer",,,"Biography information for Ms Jenny Jones","Labour",
"http://data.parliament.uk/members/560","Owen","Cardiff Central","Jones","Mr Jon Owen Jones","Male","Jonathan",,,"Biography information for Mr Jon Owen Jones","Labour (Co-op)",
"http://data.parliament.uk/members/1438",,,"Jones","Lord Beamish","Male","Kevan",,,"Biography information for Lord Beamish",,
"http://data.parliament.uk/members/303","Mary","Birmingham, Selly Oak","Jones","Lynne Jones","Female","Lynne",,,"Biography information for Lynne Jones","Labour",
"http://data.parliament.uk/members/4024","Charles","Nuneaton","Jones","Mr Marcus Jones","Male","Marcus",,,"Biography information for Mr Marcus Jones","Conservative",
"http://data.parliament.uk/members/3792",,,"Jones","Baroness Jones of Whitchurch","Female","Margaret",,,"Biography information for Baroness Jones of Whitchurch",,
"http://data.parliament.uk/members/531","David","Clwyd South","Jones","Mr Martyn Jones","Male","Martyn",,,"Biography information for Mr Martyn Jones","Labour",
"http://data.parliament.uk/members/248",,,"Jones","Lord Jones of Cheltenham","Male","Nigel",,,"Biography information for Lord Jones of Cheltenham",,
"http://data.parliament.uk/members/1148","Brannock","West Hertfordshire","Jones","Robert Jones","Male","Robert",,,"Biography information for Robert Jones","Conservative",
"http://data.parliament.uk/members/4716","Lorraine","Newport West","Jones","Ruth Jones","Female","Ruth",,,"Biography information for Ruth Jones","Labour",
"http://data.parliament.uk/members/4631","Ann","Croydon Central","Jones","Sarah Jones","Female","Sarah","www.sarah-jones.org","http://www.sarah-jones.org/","Biography information for Sarah Jones","Labour","https://twitter.com/LabourSJ"
"http://data.parliament.uk/members/530",,,"Jones","Lord Jones","Male","Stephen",,,"Biography information for Lord Jones",,
"http://data.parliament.uk/members/3956","Elan","Clwyd South","Jones","Susan Elan Jones","Female","Susan",,,"Biography information for Susan Elan Jones","Labour",
"http://data.parliament.uk/members/1071","Alec","Rhondda","Jones","Alec Jones","Male","Trevor",,,"Biography information for Alec Jones","Labour",
"http://data.parliament.uk/members/883",,,"Jopling","Lord Jopling","Male","Thomas",,,"Biography information for Lord Jopling",,
"http://data.parliament.uk/members/2552",,,"Jordan","Lord Jordan","Male","William",,,"Biography information for Lord Jordan",,
"http://data.parliament.uk/members/2976","Sinjohn",,"Joseph","Lord Joseph","Male","Keith",,,"Biography information for Lord Joseph",,
"http://data.parliament.uk/members/159",,,"Jowell","Baroness Jowell","Female","Tessa",,,"Biography information for Baroness Jowell",,
"http://data.parliament.uk/members/603","Stuart","Falkirk","Joyce","Eric Joyce","Male","Eric",,,"Biography information for Eric Joyce","Independent",
"http://data.parliament.uk/members/3517",,,"Joynson-Hicks","Viscount Brentford","Male","Crispin",,,"Biography information for Viscount Brentford",,
"http://data.parliament.uk/members/1660",,,"Judd","Lord Judd","Male","Frank",,,"Biography information for Lord Judd",,
"http://data.parliament.uk/members/3867",,,"Judge","Lord Judge","Male","Igor",,,"Biography information for Lord Judge",,
"http://data.parliament.uk/members/4862","James","East Devon","Jupp","Simon Jupp","Male","Simon",,,"Biography information for Simon Jupp","Conservative",
"http://data.parliament.uk/members/2250",,,"Kaberry","Lord Kaberry of Adel","Male","Donald",,,"Biography information for Lord Kaberry of Adel",,
"http://data.parliament.uk/members/885",,"Leeds North West","Kaberry","Sir Donald Kaberry","Male","Donald",,,"Biography information for Sir Donald Kaberry","Conservative",
"http://data.parliament.uk/members/3085",,,"Kadoorie","Lord Kadoorie","Male","Lawrence",,,"Biography information for Lord Kadoorie",,
"http://data.parliament.uk/members/2975",,,"Kagan","Lord Kagan","Male","Joseph",,,"Biography information for Lord Kagan",,
"http://data.parliament.uk/members/2339","Ferdinand",,"Kahn","Lord Kahn","Male","Richard",,,"Biography information for Lord Kahn",,
"http://data.parliament.uk/members/3766",,,"Kakkar","Lord Kakkar","Male","Ajay",,,"Biography information for Lord Kakkar",,
"http://data.parliament.uk/members/2390",,,"Kaldor","Lord Kaldor","Male","Nicholas",,,"Biography information for Lord Kaldor",,
"http://data.parliament.uk/members/3668",,,"Kalms","Lord Kalms","Male","Harold",,,"Biography information for Lord Kalms",,
"http://data.parliament.uk/members/4909",,,"Kamall","Lord Kamall","Male","Syed",,,"Biography information for Lord Kamall",,
"http://data.parliament.uk/members/4316","Joseph Patrick","Wythenshawe and Sale East","Kane","Mike Kane","Male","Michael",,,"Biography information for Mike Kane","Labour","https://twitter.com/MikeKaneMP"
"http://data.parliament.uk/members/5386",,,"Katz","Lord Katz","Male","Michael",,,"Biography information for Lord Katz",,
"http://data.parliament.uk/members/451","Bernard","Manchester, Gorton","Kaufman","Sir Gerald Kaufman","Male","Gerald",,,"Biography information for Sir Gerald Kaufman","Labour",
"http://data.parliament.uk/members/1566","Robert","Shrewsbury and Atcham","Kawczynski","Daniel Kawczynski","Male","Daniel",,,"Biography information for Daniel Kawczynski","Conservative",
"http://data.parliament.uk/members/3132","Geoffrey Nicholas",,"Kay-Shuttleworth","Lord Shuttleworth","Male","Charles",,,"Biography information for Lord Shuttleworth",,
"http://data.parliament.uk/members/2687",,,"Kearley","Viscount Devonport","Male","Terence",,,"Biography information for Viscount Devonport",,
"http://data.parliament.uk/members/4805","Alexandra Martha","Rutland and Melton","Kearns","Alicia Kearns","Female","Alicia",,,"Biography information for Alicia Kearns","Conservative",
"http://data.parliament.uk/members/3073","Frank",,"Kearton","Lord Kearton","Male","Christopher",,,"Biography information for Lord Kearton",,
"http://data.parliament.uk/members/354","Curtis","Northampton North","Keeble","Ms Sally Keeble","Female","Sally",,,"Biography information for Ms Sally Keeble","Labour",
"http://data.parliament.uk/members/4680",,"Chichester","Keegan","Gillian Keegan","Female","Gillian",,,"Biography information for Gillian Keegan","Conservative",
"http://data.parliament.uk/members/1588",,,"Keeley","Baroness Keeley","Female","Barbara",,,"Biography information for Baroness Keeley",,
"http://data.parliament.uk/members/148","Lloyd","Brentford & Isleworth","Keen","Ann Keen","Female","Ann",,,"Biography information for Ann Keen","Labour",
"http://data.parliament.uk/members/169",,"Feltham and Heston","Keen","Alan Keen","Male","David Alan",,,"Biography information for Alan Keen","Labour (Co-op)",
"http://data.parliament.uk/members/4538",,,"Keen","Lord Keen of Elie","Male","Richard",,,"Biography information for Lord Keen of Elie",,
"http://data.parliament.uk/members/266","Stuart","Hereford","Keetch","Mr Paul Keetch","Male","Paul",,,"Biography information for Mr Paul Keetch","Liberal Democrat",
"http://data.parliament.uk/members/1982","Shanks",,"Keith","Lord Keith of Kinkel","Male","Henry",,,"Biography information for Lord Keith of Kinkel",,
"http://data.parliament.uk/members/2301","Ian",,"Keith","Earl of Kintore","Male","James",,,"Biography information for Earl of Kintore",,
"http://data.parliament.uk/members/1992","Alexander",,"Keith","Lord Keith of Castleacre","Male","Kenneth",,,"Biography information for Lord Keith of Castleacre",,
"http://data.parliament.uk/members/2063","Canning William John",,"Keith","Earl of Kintore","Male","Michael",,,"Biography information for Earl of Kintore",,
"http://data.parliament.uk/members/886","Elaine","Lancaster","Kellett-Bowman","Dame Elaine Kellett-Bowman","Female","Mary",,,"Biography information for Dame Elaine Kellett-Bowman","Conservative",
"http://data.parliament.uk/members/3975",,"Dudley South","Kelly","Chris Kelly","Male","Chris",,,"Biography information for Chris Kelly","Conservative",
"http://data.parliament.uk/members/439","Maria","Bolton West","Kelly","Ruth Kelly","Female","Ruth",,,"Biography information for Ruth Kelly","Labour",
"http://data.parliament.uk/members/3401",,,"Kemp","The Lord Bishop of Chichester","Male","Eric",,,"Biography information for The Lord Bishop of Chichester",,
"http://data.parliament.uk/members/519",,"Houghton & Washington East","Kemp","Mr Fraser Kemp","Male","Fraser",,,"Biography information for Mr Fraser Kemp","Labour",
"http://data.parliament.uk/members/3106","Durival",,"Kemp","Viscount Rochdale","Male","John",,,"Biography information for Viscount Rochdale",,
"http://data.parliament.uk/members/3247",,,"Kemp","The Viscount Rochdale","Male","St",,,"Biography information for The Viscount Rochdale",,
"http://data.parliament.uk/members/4988",,,"Kempsell","Lord Kempsell","Male","Ross",,,"Biography information for Lord Kempsell",,
"http://data.parliament.uk/members/4026","Louise","Leicester West","Kendall","Liz Kendall","Female","Elizabeth","www.lizkendall.org","http://www.lizkendall.org","Biography information for Liz Kendall","Labour","https://twitter.com/leic
"http://data.parliament.uk/members/4303",,,"Kennedy","Baroness Kennedy of Cradley","Female","Alicia",,,"Biography information for Baroness Kennedy of Cradley",,
"http://data.parliament.uk/members/3458",,,"Kennedy","The Marquess of Ailsa","Male","Archibald",,,"Biography information for The Marquess of Ailsa",,
"http://data.parliament.uk/members/634","Peter","Ross, Skye and Lochaber","Kennedy","Mr Charles Kennedy","Male","Charles",,,"Biography information for Mr Charles Kennedy","Liberal Democrat",
"http://data.parliament.uk/members/1987",,,"Kennedy","Baroness Kennedy of The Shaws","Female","Helena","www.helenakennedy.co.uk","http://www.helenakennedy.co.uk/","Biography information for Baroness Kennedy of The Shaws",,
"http://data.parliament.uk/members/486","Elizabeth","Liverpool, Wavertree","Kennedy","Jane Kennedy","Female","Jane",,,"Biography information for Jane Kennedy","Labour",
"http://data.parliament.uk/members/4153",,,"Kennedy","Lord Kennedy of Southwark","Male","Roy",,,"Biography information for Lord Kennedy of Southwark",,
"http://data.parliament.uk/members/4455","Louise Ghiassi","South Ribble","Kennedy","Seema Kennedy","Female","Seema",,,"Biography information for Seema Kennedy","Conservative",
"http://data.parliament.uk/members/2229",,,"Kenworthy","Lord Strabolgi","Male","David",,,"Biography information for Lord Strabolgi",,
"http://data.parliament.uk/members/3455","Arnold Alexis",,"Keppel","Earl of Albemarle","Male","Rufus",,,"Biography information for Earl of Albemarle",,
"http://data.parliament.uk/members/4416",,"East Lothian","Kerevan","George Kerevan","Male","George",,,"Biography information for George Kerevan","Scottish National Party",
"http://data.parliament.uk/members/3894","Francis",,"Kerr","Lord Kerr of Tonaghmore","Male","Brian",,,"Biography information for Lord Kerr of Tonaghmore",,
"http://data.parliament.uk/members/4379","Robert","Berwickshire, Roxburgh and Selkirk","Kerr","Calum Kerr","Male","Calum",,,"Biography information for Calum Kerr","Scottish National Party",
"http://data.parliament.uk/members/1803",,,"Kerr","Lord Teviot","Male","Charles",,,"Biography information for Lord Teviot",,
"http://data.parliament.uk/members/3708",,,"Kerr","Lord Kerr of Kinlochard","Male","John",,,"Biography information for Lord Kerr of Kinlochard",,
"http://data.parliament.uk/members/1876","Francis Walter",,"Kerr","Marquess of Lothian","Male","Peter",,,"Biography information for Marquess of Lothian",,
"http://data.parliament.uk/members/887","Whiston","Hounslow, Feltham & Heston","Kerr","Russell Kerr","Male","Russell",,,"Biography information for Russell Kerr","Labour",
"http://data.parliament.uk/members/4604","Charles","Stirling","Kerr","Stephen Kerr","Male","Stephen",,,"Biography information for Stephen Kerr","Conservative",
"http://data.parliament.uk/members/2012","John",,"Kershaw","Lord Kershaw","Male","Edward",,,"Biography information for Lord Kershaw",,
"http://data.parliament.uk/members/888","Anthony","Stroud","Kershaw","Sir Anthony Kershaw","Male","John",,,"Biography information for Sir Anthony Kershaw","Conservative",
"http://data.parliament.uk/members/4355",,,"Kerslake","Lord Kerslake","Male","Robert",,,"Biography information for Lord Kerslake",,
"http://data.parliament.uk/members/4225",,,"Kestenbaum","Lord Kestenbaum","Male","Jonathan",,,"Biography information for Lord Kestenbaum",,
"http://data.parliament.uk/members/262","Robert","Salisbury","Key","Robert Key","Male","Simon",,,"Biography information for Robert Key","Conservative",
"http://data.parliament.uk/members/2077","George Bowlby",,"Keyes","Lord Keyes","Male","Roger",,,"Biography information for Lord Keyes",,
"http://data.parliament.uk/members/162","Singh","Ealing, Southall","Khabra","Mr Piara S Khabra","Male","Piara",,,"Biography information for Mr Piara S Khabra","Labour",
"http://data.parliament.uk/members/4671","Afzal","Manchester, Gorton","Khan","Afzal Khan","Male","Mohammed","www.afzalkhan.org.uk","http://www.afzalkhan.org.uk/","Biography information for Afzal Khan","Labour","https://twitter.com/Afza
"http://data.parliament.uk/members/1577","Aman","Tooting","Khan","Sadiq Khan","Male","Sadiq",,,"Biography information for Sadiq Khan","Labour",
"http://data.parliament.uk/members/4913",,,"Khan","Lord Khan of Burnley","Male","Wajid",,,"Biography information for Lord Khan of Burnley",,
"http://data.parliament.uk/members/283","Neil","Stafford","Kidney","Mr David Kidney","Male","David",,,"Biography information for Mr David Kidney","Labour",
"http://data.parliament.uk/members/4258",,,"Kidron","Baroness Kidron","Female","Beeban ",,,"Biography information for Baroness Kidron",,
