"uri","additional name","constituency > label","family name","full name","gender","given name","home page","home page > uri","label","party","twitter"
"http://data.parliament.uk/members/700","Barrington","Wirral South","Porter","Barry Porter","Male","George",,,"Biography information for Barry Porter","Conservative",
"http://data.parliament.uk/members/5009",,,"Porter","Baroness Porter of Fulwood","Female","Ruth",,,"Biography information for Baroness Porter of Fulwood",,
"http://data.parliament.uk/members/187","Denzil Xavier","Kensington & Chelsea","Portillo","Mr Michael Portillo","Male","Michael",,,"Biography information for Mr Michael Portillo","Conservative",
"http://data.parliament.uk/members/2462","Edward Berkeley",,"Portman","Viscount Portman","Male","Christopher",,,"Biography information for Viscount Portman",,
"http://data.parliament.uk/members/3265","Henry Berkeley",,"Portman","Viscount Portman","Male","Edward",,,"Biography information for Viscount Portman",,
"http://data.parliament.uk/members/3932","Leonard James","Central Suffolk and North Ipswich","Poulter","Dr Dan Poulter","Male","Daniel",,,"Biography information for Dr Dan Poulter","Labour",
"http://data.parliament.uk/members/161","Pelham","Ealing North","Pound","Stephen Pound","Male","Stephen",,,"Biography information for Stephen Pound","Labour",
"http://data.parliament.uk/members/2527",,,"Powell","Lord Powell of Bayswater","Male","Charles",,,"Biography information for Lord Powell of Bayswater",,
"http://data.parliament.uk/members/1023","Enoch","South Down","Powell","Enoch Powell","Male","John",,,"Biography information for Enoch Powell","Ulster Unionist Party",
"http://data.parliament.uk/members/4263","Maria","Manchester Central","Powell","Lucy Powell","Female","Lucy","lucypowell.org.uk","http://lucypowell.org.uk/","Biography information for Lucy Powell","Labour (Co-op)","https://twitter.com/LucyMPowell"
"http://data.parliament.uk/members/555",,"Ogmore","Powell","Sir Raymond Powell","Male","Raymond",,,"Biography information for Sir Raymond Powell","Labour",
"http://data.parliament.uk/members/1233","Rhys","Corby","Powell","William Powell","Male","William",,,"Biography information for William Powell","Conservative",
"http://data.parliament.uk/members/1377","Albert","Norwich South","Powley","John Powley","Male","John",,,"Biography information for John Powley","Conservative",
"http://data.parliament.uk/members/2051","Vernon",,"Powys","Lord Lilford","Male","George",,,"Biography information for Lord Lilford",,
"http://data.parliament.uk/members/2476",,,"Prasher","Baroness Prashar","Female","Usha",,,"Biography information for Baroness Prashar",,
"http://data.parliament.uk/members/3301","George Edward Henry",,"Pratt","The Marquess of Camden","Male","David",,,"Biography information for The Marquess of Camden",,
"http://data.parliament.uk/members/191","Theresa","Lewisham East","Prentice","Bridget Prentice","Female","Bridget",,,"Biography information for Bridget Prentice","Labour",
"http://data.parliament.uk/members/472",,"Pendle","Prentice","Mr Gordon Prentice","Male","Gordon",,,"Biography information for Mr Gordon Prentice","Labour",
"http://data.parliament.uk/members/3261","Ernest",,"Prentice","Lord Prentice","Male","Reginald",,,"Biography information for Lord Prentice",,
"http://data.parliament.uk/members/4974",,,"Prentis","Lord Prentis of Leeds","Male","David",,,"Biography information for Lord Prentis of Leeds",,
"http://data.parliament.uk/members/4401","Mary Boswell",,"Prentis","Baroness Prentis of Banbury","Female","Victoria",,,"Biography information for Baroness Prentis of Banbury",,
"http://data.parliament.uk/members/374",,,"Prescott","Lord Prescott","Male","John",,,"Biography information for Lord Prescott",,
"http://data.parliament.uk/members/2612","Nicholas Dudley",,"Preston","Viscount Gormanston","Male","Jenico",,,"Biography information for Viscount Gormanston",,
"http://data.parliament.uk/members/1401",,"Carmarthen East & Dinefwr","Price","Adam Price","Male","Adam",,,"Biography information for Adam Price","Plaid Cymru",
"http://data.parliament.uk/members/1337",,"Lewisham West","Price","Christopher Price","Male","Christopher",,,"Biography information for Christopher Price","Labour",
"http://data.parliament.uk/members/1283","Ernest Campbell","Eastleigh","Price","Sir David Price","Male","David",,,"Biography information for Sir David Price","Conservative",
"http://data.parliament.uk/members/4570",,,"Price","Lord Price","Male","Mark",,,"Biography information for Lord Price",,
"http://data.parliament.uk/members/3861",,,"Price","The Lord Bishop of Bath and Wells","Male","Peter",,,"Biography information for The Lord Bishop of Bath and Wells",,
"http://data.parliament.uk/members/3904","Martin",,"Priddis","The Lord Bishop of Hereford","Male","Anthony",,,"Biography information for The Lord Bishop of Hereford",,
"http://data.parliament.uk/members/217",,,"Primarolo","Baroness Primarolo","Female","Dawn",,,"Biography information for Baroness Primarolo",,
"http://data.parliament.uk/members/3237",,,"Primrose","The Earl of Rosebery","Male","Neil",,,"Biography information for The Earl of Rosebery",,
"http://data.parliament.uk/members/127",,,"Prior","Lord Prior of Brampton","Male","David",,,"Biography information for Lord Prior of Brampton",,
"http://data.parliament.uk/members/1104","Michael Leathes",,"Prior","Lord Prior","Male","James",,,"Biography information for Lord Prior",,
"http://data.parliament.uk/members/1424","Mark","Hertford and Stortford","Prisk","Mr Mark Prisk","Male","Michael",,,"Biography information for Mr Mark Prisk","Conservative",
"http://data.parliament.uk/members/2953","Wilbraham",,"Pritchard","Lord Pritchard","Male","Derek",,,"Biography information for Lord Pritchard",,
"http://data.parliament.uk/members/4188",,,"Pritchard","The Lord Bishop of Oxford","Male","John",,,"Biography information for The Lord Bishop of Oxford",,
"http://data.parliament.uk/members/1576","Andrew","The Wrekin","Pritchard","Mark Pritchard","Male","Mark","www.markpritchard.com","http://www.markpritchard.com","Biography information for Mark Pritchard","Conservative","https://twitter.com/MPritchardMP"
"http://data.parliament.uk/members/1343","Harvey","Billericay","Proctor","Harvey Proctor","Male","Keith",,,"Biography information for Harvey Proctor","Conservative",
"http://data.parliament.uk/members/80","Mathews","Dover","Prosser","Gwyn Prosser","Male","Gwynfor",,,"Biography information for Gwyn Prosser","Labour",
"http://data.parliament.uk/members/3684",,,"Prosser","Baroness Prosser","Female","Margaret",,,"Biography information for Baroness Prosser",,
"http://data.parliament.uk/members/1683",,"Brighouse & Spenborough","Proudfoot","Wilfred Proudfoot","Male","Wilfred",,,"Biography information for Wilfred Proudfoot","Conservative",
"http://data.parliament.uk/members/2067","James",,"Prout","The Lord Kingsland","Male","Christopher",,,"Biography information for The Lord Kingsland",,
"http://data.parliament.uk/members/3259",,,"Prys-Davies","Lord Prys-Davies","Male","Gwilym",,,"Biography information for Lord Prys-Davies",,
"http://data.parliament.uk/members/1454","David","Southport","Pugh","John Pugh","Male","John",,,"Biography information for John Pugh","Liberal Democrat",
"http://data.parliament.uk/members/321",,"Wolverhampton North East","Purchase","Mr Ken Purchase","Male","Kenneth",,,"Biography information for Mr Ken Purchase","Labour",
"http://data.parliament.uk/members/1455","Mark Dakin","Stalybridge & Hyde","Purnell","James Purnell","Male","James",,,"Biography information for James Purnell","Labour",
"http://data.parliament.uk/members/4369","Christopher John","Corby","Pursglove","Tom Pursglove","Male","Thomas",,,"Biography information for Tom Pursglove","Conservative",
"http://data.parliament.uk/members/4293",,,"Purvis","Lord Purvis of Tweed","Male","Jeremy ",,,"Biography information for Lord Purvis of Tweed",,
"http://data.parliament.uk/members/3268",,,"Puttnam","Lord Puttnam","Male","David",,,"Biography information for Lord Puttnam",,
"http://data.parliament.uk/members/3257","Leslie",,"Pym","Lord Pym","Male","Francis",,,"Biography information for Lord Pym",,
"http://data.parliament.uk/members/4917",,"Airdrie and Shotts","Qaisar","Ms Anum Qaisar","Female","Anum",,,"Biography information for Ms Anum Qaisar","Scottish National Party",
"http://data.parliament.uk/members/4507","Mark","Horsham","Quin","Sir Jeremy Quin","Male","Jeremy",,,"Biography information for Sir Jeremy Quin","Conservative",
"http://data.parliament.uk/members/518",,,"Quin","Baroness Quin","Female","Joyce",,,"Biography information for Baroness Quin",,
"http://data.parliament.uk/members/4423","James","Colchester","Quince","Will Quince","Male","William",,,"Biography information for Will Quince","Conservative",
"http://data.parliament.uk/members/381","William","Scarborough & Whitby","Quinn","Lawrie Quinn","Male","Lawrence",,,"Biography information for Lawrie Quinn","Labour",
"http://data.parliament.uk/members/3255","Meredith",,"Quinton","Lord Quinton","Male","Anthony",,,"Biography information for Lord Quinton",,
"http://data.parliament.uk/members/3254","Randolph",,"Quirk","Lord Quirk","Male","Charles",,,"Biography information for Lord Quirk",,
"http://data.parliament.uk/members/3924",,"Bolton South East","Qureshi","Yasmin Qureshi","Female","Yasmin ","www.yasminqureshi.org.uk","http://www.yasminqureshi.org.uk","Biography information for Yasmin Qureshi","Labour","https://twitter.com/YasminQureshiMP"
"http://data.parliament.uk/members/4007","Rennie","Esher and Walton","Raab","Dominic Raab","Male","Dominic",,,"Biography information for Dominic Raab","Conservative",
"http://data.parliament.uk/members/1193","Alan Reginald","Wood Green","Race","Dr Reg Race","Male","Denys",,,"Biography information for Dr Reg Race","Labour",
"http://data.parliament.uk/members/510",,,"Radice","Lord Radice","Male","Giles",,,"Biography information for Lord Radice",,
"http://data.parliament.uk/members/1280","William Twort","Delyn","Raffan","Keith Raffan","Male","Keith",,,"Biography information for Keith Raffan","Conservative",
"http://data.parliament.uk/members/5400","Marie",,"Rafferty","Baroness Rafferty","Female","Anne",,,"Biography information for Baroness Rafferty",,
"http://data.parliament.uk/members/935","Hugh Francis","Aylesbury","Raison","Sir Timothy Raison","Male","Timothy",,,"Biography information for Sir Timothy Raison","Conservative",
"http://data.parliament.uk/members/37","Ernest","Harlow","Rammell","Bill Rammell","Male","William",,,"Biography information for Bill Rammell","Labour",
"http://data.parliament.uk/members/2469","Hubert",,"Ramsay","Earl of Dalhousie","Male","James",,,"Biography information for Earl of Dalhousie",,
"http://data.parliament.uk/members/3276",,,"Ramsay","Baroness Ramsay of Cartvale","Female","Meta",,,"Biography information for Baroness Ramsay of Cartvale",,
"http://data.parliament.uk/members/2733",,,"Ramsay","Earl of Dalhousie","Male","Simon",,,"Biography information for Earl of Dalhousie",,
"http://data.parliament.uk/members/3744",,,"Ramsbotham","Lord Ramsbotham","Male","David",,,"Biography information for Lord Ramsbotham",,
"http://data.parliament.uk/members/3145",,,"Ramsbotham","The Viscount Soulbury","Male","James",,,"Biography information for The Viscount Soulbury",,
"http://data.parliament.uk/members/1684",,"Harrogate","Ramsden","James Ramsden","Male","James",,,"Biography information for James Ramsden","Conservative",
"http://data.parliament.uk/members/2387","Michael",,"Ramsey","Lord Ramsey of Canterbury","Male","Arthur",,,"Biography information for Lord Ramsey of Canterbury",,
"http://data.parliament.uk/members/5022",,,"Ramsey","Baroness Ramsey of Wall Heath","Female","Jane",,,"Biography information for Baroness Ramsey of Wall Heath",,
"http://data.parliament.uk/members/3689",,,"Rana","Lord Rana","Male","Diljit",,,"Biography information for Lord Rana",,
"http://data.parliament.uk/members/209",,,"Randall","Lord Randall of Uxbridge","Male","Alexander",,,"Biography information for Lord Randall of Uxbridge",,
"http://data.parliament.uk/members/1152",,,"Randall","Lord Randall of St Budeaux","Male","Stuart",,,"Biography information for Lord Randall of St Budeaux",,
"http://data.parliament.uk/members/4845","William ","Gedling","Randall","Tom Randall","Male","Thomas ",,,"Biography information for Tom Randall","Conservative",
"http://data.parliament.uk/members/4230","Elizabeth",,"Randerson","Baroness Randerson","Female","Jennifer",,,"Biography information for Baroness Randerson",,
"http://data.parliament.uk/members/4989",,,"Ranger","Lord Ranger of Northwood","Male","Kulveer",,,"Biography information for Lord Ranger of Northwood",,
"http://data.parliament.uk/members/4729",,,"Ranger","Lord Ranger","Male","Raminder",,,"Biography information for Lord Ranger",,
"http://data.parliament.uk/members/58","Norman John","Portsmouth North","Rapson","Syd Rapson","Male","Sydney",,,"Biography information for Syd Rapson","Labour",
"http://data.parliament.uk/members/4670","Faisal","Warrington South","Rashid","Faisal Rashid","Male","Mian",,,"Biography information for Faisal Rashid","Labour",
"http://data.parliament.uk/members/1247","Rankin","Lewes","Rathbone","Tim Rathbone","Male","John",,,"Biography information for Tim Rathbone","Conservative",
"http://data.parliament.uk/members/5388",,,"Raval","Lord Raval","Male","Kumar",,,"Biography information for Lord Raval",,
"http://data.parliament.uk/members/3278",,,"Rawlings","Baroness Rawlings","Female","Patricia",,,"Biography information for Baroness Rawlings",,
"http://data.parliament.uk/members/3269","Anthony Grayson",,"Rawlinson","Lord Rawlinson of Ewell","Male","Peter",,,"Biography information for Lord Rawlinson of Ewell",,
"http://data.parliament.uk/members/3285",,,"Rayne","Lord Rayne","Male","Max",,,"Biography information for Lord Rayne",,
"http://data.parliament.uk/members/4356",,"Ashton-under-Lyne","Rayner","Angela Rayner","Female","Angela",,,"Biography information for Angela Rayner","Labour","https://twitter.com/angelarayner"
"http://data.parliament.uk/members/2847","George",,"Rayner","The Lord Rayner","Male","Derek",,,"Biography information for The Lord Rayner",,
"http://data.parliament.uk/members/171","Richard Nicolls","Greenwich and Woolwich","Raynsford","Mr Nick Raynsford","Male","Wyvill",,,"Biography information for Mr Nick Raynsford","Labour",
"http://data.parliament.uk/members/3275",,,"Razzall","Lord Razzall","Male","Edward",,,"Biography information for Lord Razzall",,
"http://data.parliament.uk/members/3274",,,"Rea","Lord Rea","Male","John",,,"Biography information for Lord Rea",,
"http://data.parliament.uk/members/3776","Stewart",,"Reade","The Lord Bishop of Blackburn","Male","Nicholas",,,"Biography information for The Lord Bishop of Blackburn",,
"http://data.parliament.uk/members/4332",,,"Rebuck","Baroness Rebuck","Female","Gail",,,"Biography information for Baroness Rebuck",,
"http://data.parliament.uk/members/4049",,"Rochester and Strood","Reckless","Mark Reckless","Male","Mark",,,"Biography information for Mark Reckless","UK Independence Party",
"http://data.parliament.uk/members/4143",,,"Redfern","The Lord Bishop of Derby","Male","Alastair",,,"Biography information for The Lord Bishop of Derby",,
"http://data.parliament.uk/members/4551",,,"Redfern ","Baroness Redfern","Female","Elizabeth",,,"Biography information for Baroness Redfern",,
"http://data.parliament.uk/members/1153",,"Don Valley","Redmond","Martin Redmond","Male","Martin",,,"Biography information for Martin Redmond","Labour",
"http://data.parliament.uk/members/14","Alan","Wokingham","Redwood","Sir John Redwood","Male","John",,,"Biography information for Sir John Redwood","Conservative",
"http://data.parliament.uk/members/341","John","Loughborough","Reed","Mr Andy Reed","Male","Andrew",,,"Biography information for Mr Andy Reed","Labour (Co-op)",
"http://data.parliament.uk/members/1685",,"Sedgefield","Reed","David Reed","Male","David",,,"Biography information for David Reed","Labour",
"http://data.parliament.uk/members/1503","Ronald","Copeland","Reed","Mr Jamie Reed","Male","Jamieson",,,"Biography information for Mr Jamie Reed","Labour",
"http://data.parliament.uk/members/1686",,"Bolton East","Reed","Laurance Reed","Male","Laurance",,,"Biography information for Laurance Reed","Conservative",
"http://data.parliament.uk/members/4875",,,"Reed","Lord Reed of Allermuir","Male","Robert",,,"Biography information for Lord Reed of Allermuir",,
"http://data.parliament.uk/members/4268","Mark Ward","Croydon North","Reed","Steve Reed","Male","Steven","www.stevereedmp.co.uk","http://www.stevereedmp.co.uk/","Biography information for Steve Reed","Labour (Co-op)","https://twitter.com/SteveReedMP"
"http://data.parliament.uk/members/4525","Elizabeth","Neath","Rees","Christina Rees","Female","Christina",,,"Biography information for Christina Rees","Labour (Co-op)",
"http://data.parliament.uk/members/3751",,,"Rees","Lord Rees of Ludlow","Male","Martin",,,"Biography information for Lord Rees of Ludlow",,
"http://data.parliament.uk/members/5397","Johnathan",,"Rees","Lord Rees of Easton","Male","Marvin",,,"Biography information for Lord Rees of Easton",,
"http://data.parliament.uk/members/936",,"Morley & Leeds South","Rees","Merlyn Rees","Male","Merlyn",,,"Biography information for Merlyn Rees","Labour",
"http://data.parliament.uk/members/3270","Wynford Innes",,"Rees","Lord Rees","Male","Peter",,,"Biography information for Lord Rees",,
"http://data.parliament.uk/members/1943",,,"Rees (took Merlyn-Rees)","Lord Merlyn-Rees","Male","Merlyn",,,"Biography information for Lord Merlyn-Rees",,
"http://data.parliament.uk/members/1362","Rupert","Thanet West","Rees-Davies","William Rees-Davies","Male","William",,,"Biography information for William Rees-Davies","Conservative",
"http://data.parliament.uk/members/4099","William","North East Somerset","Rees-Mogg","Sir Jacob Rees-Mogg","Male","Jacob",,,"Biography information for Sir Jacob Rees-Mogg","Conservative",
"http://data.parliament.uk/members/3244",,,"Rees-Mogg","Lord Rees-Mogg","Male","William",,,"Biography information for Lord Rees-Mogg",,
"http://data.parliament.uk/members/3216","Rees",,"Rees-Williams","Lord Ogmore","Male","Gwilym",,,"Biography information for Lord Ogmore",,
"http://data.parliament.uk/members/3978",,"Dewsbury","Reevell","Simon Reevell","Male","Simon",,,"Biography information for Simon Reevell","Conservative",
"http://data.parliament.uk/members/4620","Claire","Lewisham West and Penge","Reeves","Ellie Reeves","Female","Eleanor",,,"Biography information for Ellie Reeves","Labour","https://twitter.com/elliereeves"
"http://data.parliament.uk/members/4031","Jane","Leeds West","Reeves","Rachel Reeves","Female","Rachel",,,"Biography information for Rachel Reeves","Labour","https://twitter.com/RachelReevesMP"
"http://data.parliament.uk/members/1385",,"Argyll and Bute","Reid","Mr Alan Reid","Male","Alan",,,"Biography information for Mr Alan Reid","Liberal Democrat",
"http://data.parliament.uk/members/1687",,"Clackmannan & East Stirlingshire","Reid","George Reid","Male","George",,,"Biography information for George Reid","Scottish National Party",
"http://data.parliament.uk/members/617",,,"Reid","Lord Reid of Cardowan","Male","John",,,"Biography information for Lord Reid of Cardowan",,
"http://data.parliament.uk/members/2292",,,"Reilly","Lord Reilly","Male","Paul",,,"Biography information for Lord Reilly",,
"http://data.parliament.uk/members/3284",,,"Remnant","Lord Remnant","Male","James",,,"Biography information for Lord Remnant",,
"http://data.parliament.uk/members/4946",,,"Remnant","Lord Remnant","Male","Philip",,,"Biography information for Lord Remnant",,
"http://data.parliament.uk/members/9","Digby","Newbury","Rendel","Mr David Rendel","Male","David",,,"Biography information for Mr David Rendel","Liberal Democrat",
"http://data.parliament.uk/members/3258","Barbara",,"Rendell","Baroness Rendell of Babergh","Female","Ruth",,,"Biography information for Baroness Rendell of Babergh",,
"http://data.parliament.uk/members/3234",,,"Renfrew","Lord Renfrew of Kaimsthorn","Male","Andrew",,,"Biography information for Lord Renfrew of Kaimsthorn",,
"http://data.parliament.uk/members/2484",,,"Rennard","Lord Rennard","Male","Christopher","www.libdems.org.uk","http://www.libdems.org.uk","Biography information for Lord Rennard",,
"http://data.parliament.uk/members/1600","Cowan","Dunfermline and West Fife","Rennie","Willie Rennie","Male","William",,,"Biography information for Willie Rennie","Liberal Democrat",
"http://data.parliament.uk/members/3232","Lockhart-Mure",,"Renton","Lord Renton","Male","David",,,"Biography information for Lord Renton",,
"http://data.parliament.uk/members/937",,,"Renton","Lord Renton of Mount Harry","Male","Ronald",,,"Biography information for Lord Renton of Mount Harry",,
"http://data.parliament.uk/members/3231",,,"Renwick","Lord Renwick","Male","Harry",,,"Biography information for Lord Renwick",,
"http://data.parliament.uk/members/3230",,,"Renwick","Lord Renwick of Clifton","Male","Robin",,,"Biography information for Lord Renwick of Clifton",,
"http://data.parliament.uk/members/4077","Elizabeth","Wolverhampton North East","Reynolds","Emma Reynolds","Female","Emma",,,"Biography information for Emma Reynolds","Labour",
"http://data.parliament.uk/members/4119","Neil","Stalybridge and Hyde","Reynolds","Jonathan Reynolds","Male","Jonathan","www.jonathanreynolds.org.uk","http://www.jonathanreynolds.org.uk","Biography information for Jonathan Reynolds","Labour (Co-op)","https://twitter.com/jreynoldsMP"
"http://data.parliament.uk/members/2350",,,"Rhodes","Lord Rhodes","Male","Henry",,,"Biography information for Lord Rhodes",,
"http://data.parliament.uk/members/938","Vidal","Cambridge","Rhodes James","Sir Robert Rhodes James","Male","Robert",,,"Biography information for Sir Robert Rhodes James","Conservative",
"http://data.parliament.uk/members/2714","Charles Uryan",,"Rhys","Lord Dynevor","Male","Richard",,,"Biography information for Lord Dynevor",,
"http://data.parliament.uk/members/702","Meredith","Kensington","Rhys Williams","Sir Brandon Rhys Williams","Male","Brandon",,,"Biography information for Sir Brandon Rhys Williams","Conservative",
"http://data.parliament.uk/members/4195","Francisco",,"Ribeiro","Lord Ribeiro","Male","Bernard",,,"Biography information for Lord Ribeiro",,
"http://data.parliament.uk/members/4764","Janet","Streatham","Ribeiro-Addy","Bell Ribeiro-Addy","Female","Bellavia",,,"Biography information for Bell Ribeiro-Addy","Labour",
"http://data.parliament.uk/members/1688","Seward",,"Richard","Lord Richard","Male","Ivor",,,"Biography information for Lord Richard",,
"http://data.parliament.uk/members/4317",,,"Richards","Lord Richards of Herstmonceux","Male","David",,,"Biography information for Lord Richards of Herstmonceux",,
"http://data.parliament.uk/members/1939",,,"Richards","Lord Milverton","Male","Fraser",,,"Biography information for Lord Milverton",,
"http://data.parliament.uk/members/4868","Faye","West Bromwich East","Richards","Nicola Richards","Female","Nicola",,,"Biography information for Nicola Richards","Conservative",
"http://data.parliament.uk/members/1477",,"Clwyd North West","Richards","Rod Richards","Male","Roderick",,,"Biography information for Rod Richards","Conservative",
"http://data.parliament.uk/members/4840","Joy","Guildford","Richardson","Angela Richardson","Female","Angela",,,"Biography information for Angela Richardson","Conservative",
"http://data.parliament.uk/members/3225","William Humphreys",,"Richardson","The Lord Richardson of Duntisbourne","Male","Gordon",,,"Biography information for The Lord Richardson of Duntisbourne",,
"http://data.parliament.uk/members/3227","Samuel",,"Richardson","Lord Richardson","Male","John",,,"Biography information for Lord Richardson",,
"http://data.parliament.uk/members/687",,"Barking","Richardson","Jo Richardson","Female","Josephine",,,"Biography information for Jo Richardson","Labour",
"http://data.parliament.uk/members/3235","Margaret",,"Richardson","Baroness Richardson of Calow","Female","Kathleen",,,"Biography information for Baroness Richardson of Calow",,
"http://data.parliament.uk/members/4587",,,"Ricketts","Lord Ricketts","Male","Peter",,,"Biography information for Lord Ricketts",,
"http://data.parliament.uk/members/939","Edward Galloway","Colne Valley","Riddick","Graham Riddick","Male","Graham",,,"Biography information for Graham Riddick","Conservative",
"http://data.parliament.uk/members/3223",,,"Ridley","The Viscount Ridley","Male","Matthew",,,"Biography information for The Viscount Ridley",,
"http://data.parliament.uk/members/4272",,,"Ridley","Viscount Ridley","Male","Matthew",,,"Biography information for Viscount Ridley",,
"http://data.parliament.uk/members/1304",,"Cirencester & Tewkesbury","Ridley","Nicholas Ridley","Male","Nicholas",,,"Biography information for Nicholas Ridley","Conservative",
"http://data.parliament.uk/members/2849",,,"Ridley","Lord Ridley of Liddesdale","Male","Nicholas",,,"Biography information for Lord Ridley of Liddesdale",,
"http://data.parliament.uk/members/1287","Errington","Harwich","Ridsdale","Sir Julian Ridsdale","Male","Julian",,,"Biography information for Sir Julian Ridsdale","Conservative",
"http://data.parliament.uk/members/1191","Leslie","Kensington","Rifkind","Sir Malcolm Rifkind","Male","Malcolm",,,"Biography information for Sir Malcolm Rifkind","Independent",
"http://data.parliament.uk/members/4457","Elizabeth","St Helens South and Whiston","Rimmer","Ms Marie Rimmer","Female","Marie",,,"Biography information for Ms Marie Rimmer","Labour","https://twitter.com/MarieRimmerMP"
"http://data.parliament.uk/members/1525",,"Halifax","Riordan","Mrs Linda Riordan","Female","Linda",,,"Biography information for Mrs Linda Riordan","Labour (Co-op)",
"http://data.parliament.uk/members/1327","Geoffrey Frederick","Hexham","Rippon","Geoffrey Rippon","Male","Aubrey",,,"Biography information for Geoffrey Rippon","Conservative",
